13.05.04;Kec. 2 x 11 Enam Lingkuang, KAB. PADANG PARIAMAN, SUMATERA BARAT
13.05.15;Kec. 2 x 11 Kayu Tanam, KAB. PADANG PARIAMAN, SUMATERA BARAT
16.12.04;Kec. Abab, KAB. PENUKAL ABAB LEMATANG ILIR, SUMATERA SELATAN
53.05.18;Kec. Abad Selatan, KAB. ALOR, NUSA TENGGARA TIMUR
51.07.05;Kec. Abang, KAB. KARANGASEM, BALI
74.71.06;Kec. Abeli, KOTA KENDARI, SULAWESI TENGGARA
95.06.03;Kec. Abenaho, KAB. YALIMO, PAPUA PEGUNUNGAN
91.71.03;Kec. Abepura, KOTA JAYAPURA, PAPUA
51.03.03;Kec. Abiansemal, KAB. BADUNG, BALI
95.02.08;Kec. Aboy, KAB. PEGUNUNGAN BINTANG, PAPUA PEGUNUNGAN
74.02.10;Kec. Abuki, KAB. KONAWE, SULAWESI TENGGARA
92.09.06;Kec. Abun, KAB. TAMBRAUW, PAPUA BARAT
18.03.06;Kec. Abung Barat, KAB. LAMPUNG UTARA, LAMPUNG
18.03.22;Kec. Abung Kunang, KAB. LAMPUNG UTARA, LAMPUNG
18.03.19;Kec. Abung Pekurun, KAB. LAMPUNG UTARA, LAMPUNG
18.03.07;Kec. Abung Selatan, KAB. LAMPUNG UTARA, LAMPUNG
18.03.13;Kec. Abung Semuli, KAB. LAMPUNG UTARA, LAMPUNG
18.03.14;Kec. Abung Surakarta, KAB. LAMPUNG UTARA, LAMPUNG
18.03.11;Kec. Abung Tengah, KAB. LAMPUNG UTARA, LAMPUNG
18.03.05;Kec. Abung Timur, KAB. LAMPUNG UTARA, LAMPUNG
18.03.12;Kec. Abung Tinggi, KAB. LAMPUNG UTARA, LAMPUNG
12.02.03;Kec. Adian Koting, KAB. TAPANULI UTARA, SUMATERA UTARA
18.10.07;Kec. Adiluwih, KAB. PRINGSEWU, LAMPUNG
33.05.15;Kec. Adimulyo, KAB. KEBUMEN, JAWA TENGAH
33.01.03;Kec. Adipala, KAB. CILACAP, JAWA TENGAH
33.28.11;Kec. Adiwerna, KAB. TEGAL, JAWA TENGAH
53.06.17;Kec. Adonara, KAB. FLORES TIMUR, NUSA TENGGARA TIMUR
53.06.08;Kec. Adonara Barat, KAB. FLORES TIMUR, NUSA TENGGARA TIMUR
53.06.18;Kec. Adonara Tengah, KAB. FLORES TIMUR, NUSA TENGGARA TIMUR
53.06.10;Kec. Adonara Timur, KAB. FLORES TIMUR, NUSA TENGGARA TIMUR
12.03.22;Kec. Aek Bilah, KAB. TAPANULI SELATAN, SUMATERA UTARA
12.09.18;Kec. Aek Kuasan, KAB. ASAHAN, SUMATERA UTARA
12.23.04;Kec. Aek Kuo, KAB. LABUHANBATU UTARA, SUMATERA UTARA
12.09.32;Kec. Aek Ledong, KAB. ASAHAN, SUMATERA UTARA
12.21.11;Kec. Aek Nabara Barumun, KAB. PADANG LAWAS, SUMATERA UTARA
12.23.07;Kec. Aek Natas, KAB. LABUHANBATU UTARA, SUMATERA UTARA
12.09.21;Kec. Aek Songsongan, KAB. ASAHAN, SUMATERA UTARA
74.11.10;Kec. Aere, KAB. KOLAKA TIMUR, SULAWESI TENGGARA
71.72.04;Kec. Aertembaga, KOTA BITUNG, SULAWESI UTARA
53.16.01;Kec. Aesesa, KAB. NAGEKEO, NUSA TENGGARA TIMUR
53.16.07;Kec. Aesesa Selatan, KAB. NAGEKEO, NUSA TENGGARA TIMUR
12.24.09;Kec. Afulu, KAB. NIAS UTARA, SUMATERA UTARA
94.05.07;Kec. Agandugume, KAB. PUNCAK, PAPUA TENGAH
93.04.01;Kec. Agats, KAB. ASMAT, PAPUA SELATAN
94.04.02;Kec. Agimuga, KAB. MIMIKA, PAPUA TENGAH
94.07.05;Kec. Agisiga, KAB. INTAN JAYA, PAPUA TENGAH
32.03.22;Kec. Agrabinta, KAB. CIANJUR, JAWA BARAT
92.10.01;Kec. Aifat, KAB. MAYBRAT, PAPUA BARAT
92.10.04;Kec. Aifat Selatan, KAB. MAYBRAT, PAPUA BARAT
92.10.03;Kec. Aifat Timur, KAB. MAYBRAT, PAPUA BARAT
92.10.13;Kec. Aifat Timur Jauh, KAB. MAYBRAT, PAPUA BARAT
92.10.14;Kec. Aifat Timur Selatan, KAB. MAYBRAT, PAPUA BARAT
92.10.12;Kec. Aifat Timur Tengah, KAB. MAYBRAT, PAPUA BARAT
92.10.02;Kec. Aifat Utara, KAB. MAYBRAT, PAPUA BARAT
52.03.09;Kec. Aikmel, KAB. LOMBOK TIMUR, NUSA TENGGARA BARAT
91.06.19;Kec. Aimando Padaido, KAB. BIAK NUMFOR, PAPUA
92.01.07;Kec. Aimas, KAB. SORONG, PAPUA BARAT
53.09.01;Kec. Aimere, KAB. NGADA, NUSA TENGGARA TIMUR
12.09.13;Kec. Air Batu, KAB. ASAHAN, SUMATERA UTARA
61.08.05;Kec. Air Besar, KAB. LANDAK, KALIMANTAN BARAT
17.03.15;Kec. Air Besi, KAB. BENGKULU UTARA, BENGKULU
81.04.02;Kec. Air Buaya, KAB. BURU, MALUKU
17.06.14;Kec. Air Dikit, KAB. MUKO MUKO, BENGKULU
15.01.05;Kec. Air Hangat, KAB. KERINCI, JAMBI
15.01.21;Kec. Air Hangat Barat, KAB. KERINCI, JAMBI
15.01.11;Kec. Air Hangat Timur, KAB. KERINCI, JAMBI
15.03.07;Kec. Air Hitam, KAB. SAROLANGUN, JAMBI
18.04.19;Kec. Air Hitam, KAB. LAMPUNG BARAT, LAMPUNG
12.09.09;Kec. Air Joman, KAB. ASAHAN, SUMATERA UTARA
16.07.19;Kec. Air Kumbang, KAB. BANYUASIN, SUMATERA SELATAN
17.06.13;Kec. Air Majunto, KAB. MUKO MUKO, BENGKULU
18.06.26;Kec. Air Naningan, KAB. TANGGAMUS, LAMPUNG
17.03.16;Kec. Air Napal, KAB. BENGKULU UTARA, BENGKULU
17.01.08;Kec. Air Nipis, KAB. BENGKULU SELATAN, BENGKULU
17.03.20;Kec. Air Padang, KAB. BENGKULU UTARA, BENGKULU
17.05.06;Kec. Air Periukan, KAB. SELUMA, BENGKULU
12.19.03;Kec. Air Putih, KAB. BATU BARA, SUMATERA UTARA
17.06.07;Kec. Air Rami, KAB. MUKO MUKO, BENGKULU
16.07.14;Kec. Air Salek, KAB. BANYUASIN, SUMATERA SELATAN
16.02.14;Kec. Air Sugihan, KAB. OGAN KOMERING ILIR, SUMATERA SELATAN
61.04.21;Kec. Air Upas, KAB. KETAPANG, KALIMANTAN BARAT
95.04.28;Kec. Airgaram, KAB. TOLIKARA, PAPUA PEGUNUNGAN
19.03.03;Kec. Airgegas, KAB. BANGKA SELATAN, KEPULAUAN BANGKA BELITUNG
71.06.03;Kec. Airmadidi, KAB. MINAHASA UTARA, SULAWESI UTARA
13.01.13;Kec. Airpura, KAB. PESISIR SELATAN, SUMATERA BARAT
91.03.16;Kec. Airu, KAB. JAYAPURA, PAPUA
92.10.06;Kec. Aitinyo, KAB. MAYBRAT, PAPUA BARAT
92.10.05;Kec. Aitinyo Barat, KAB. MAYBRAT, PAPUA BARAT
92.10.23;Kec. Aitinyo Raya, KAB. MAYBRAT, PAPUA BARAT
92.10.22;Kec. Aitinyo Tengah, KAB. MAYBRAT, PAPUA BARAT
92.10.07;Kec. Aitinyo Utara, KAB. MAYBRAT, PAPUA BARAT
73.08.18;Kec. Ajangale, KAB. BONE, SULAWESI SELATAN
33.02.14;Kec. Ajibarang, KAB. BANYUMAS, JAWA TENGAH
12.12.08;Kec. Ajibata, KAB. TOBA, SUMATERA UTARA
35.09.17;Kec. Ajung, KAB. JEMBER, JAWA TIMUR
13.07.13;Kec. Akabiluru, KAB. LIMA PULUH KOTA, SUMATERA BARAT
93.04.04;Kec. Akat, KAB. ASMAT, PAPUA SELATAN
11.09.08;Kec. Alafan, KAB. SIMEULUE, ACEH
53.71.01;Kec. Alak, KOTA KUPANG, NUSA TENGGARA TIMUR
63.04.05;Kec. Alalak, KAB. BARITO KUALA, KALIMANTAN SELATAN
15.71.09;Kec. Alam Barajo, KOTA JAMBI, JAMBI
94.04.18;Kec. Alama, KAB. MIMIKA, PAPUA TENGAH
95.08.15;Kec. Alama, KAB. NDUGA, PAPUA PEGUNUNGAN
16.71.15;Kec. Alang-alang Lebar, KOTA PALEMBANG, SUMATERA SELATAN
52.04.05;Kec. Alas, KAB. SUMBAWA, NUSA TENGGARA BARAT
52.04.17;Kec. Alas Barat, KAB. SUMBAWA, NUSA TENGGARA BARAT
12.24.07;Kec. Alasa, KAB. NIAS UTARA, SUMATERA UTARA
12.24.06;Kec. Alasa Talumuzoi, KAB. NIAS UTARA, SUMATERA UTARA
95.02.11;Kec. Alemsom, KAB. PEGUNUNGAN BINTANG, PAPUA PEGUNUNGAN
33.05.11;Kec. Alian, KAB. KEBUMEN, JAWA TENGAH
73.16.05;Kec. Alla, KAB. ENREKANG, SULAWESI SELATAN
76.04.15;Kec. Allu, KAB. POLEWALI MANDAR, SULAWESI BARAT
53.07.05;Kec. Alok, KAB. SIKKA, NUSA TENGGARA TIMUR
53.07.14;Kec. Alok Barat, KAB. SIKKA, NUSA TENGGARA TIMUR
53.07.15;Kec. Alok Timur, KAB. SIKKA, NUSA TENGGARA TIMUR
53.05.03;Kec. Alor Barat Daya, KAB. ALOR, NUSA TENGGARA TIMUR
53.05.02;Kec. Alor Barat Laut, KAB. ALOR, NUSA TENGGARA TIMUR
53.05.04;Kec. Alor Selatan, KAB. ALOR, NUSA TENGGARA TIMUR
53.05.07;Kec. Alor Tengah Utara, KAB. ALOR, NUSA TENGGARA TIMUR
53.05.05;Kec. Alor Timur, KAB. ALOR, NUSA TENGGARA TIMUR
53.05.08;Kec. Alor Timur Laut, KAB. ALOR, NUSA TENGGARA TIMUR
63.03.01;Kec. Aluh Aluh, KAB. BANJAR, KALIMANTAN SELATAN
53.01.25;Kec. Amabi Oefeto, KAB. KUPANG, NUSA TENGGARA TIMUR
53.01.20;Kec. Amabi Oefeto Timur, KAB. KUPANG, NUSA TENGGARA TIMUR
81.01.01;Kec. Amahai, KAB. MALUKU TENGAH, MALUKU
81.06.05;Kec. Amalatu, KAB. SERAM BAGIAN BARAT, MALUKU
73.08.24;Kec. Amali, KAB. BONE, SULAWESI SELATAN
53.02.08;Kec. Amanatun Selatan, KAB. TIMOR TENGAH SELATAN, NUSA TENGGARA TIMUR
53.02.09;Kec. Amanatun Utara, KAB. TIMOR TENGAH SELATAN, NUSA TENGGARA TIMUR
12.14.07;Kec. Amandraya, KAB. NIAS SELATAN, SUMATERA UTARA
53.02.07;Kec. Amanuban Barat, KAB. TIMOR TENGAH SELATAN, NUSA TENGGARA TIMUR
53.02.06;Kec. Amanuban Selatan, KAB. TIMOR TENGAH SELATAN, NUSA TENGGARA TIMUR
53.02.05;Kec. Amanuban Tengah, KAB. TIMOR TENGAH SELATAN, NUSA TENGGARA TIMUR
53.02.04;Kec. Amanuban Timur, KAB. TIMOR TENGAH SELATAN, NUSA TENGGARA TIMUR
94.04.17;Kec. Amar, KAB. MIMIKA, PAPUA TENGAH
53.01.09;Kec. Amarasi, KAB. KUPANG, NUSA TENGGARA TIMUR
53.01.17;Kec. Amarasi Barat, KAB. KUPANG, NUSA TENGGARA TIMUR
53.01.18;Kec. Amarasi Selatan, KAB. KUPANG, NUSA TENGGARA TIMUR
53.01.19;Kec. Amarasi Timur, KAB. KUPANG, NUSA TENGGARA TIMUR
33.05.07;Kec. Ambal, KAB. KEBUMEN, JAWA TENGAH
61.05.15;Kec. Ambalau, KAB. SINTANG, KALIMANTAN BARAT
81.09.03;Kec. Ambalau, KAB. BURU SELATAN, MALUKU
52.06.10;Kec. Ambalawi, KAB. BIMA, NUSA TENGGARA BARAT
18.10.03;Kec. Ambarawa, KAB. PRINGSEWU, LAMPUNG
33.22.10;Kec. Ambarawa, KAB. SEMARANG, JAWA TENGAH
93.02.11;Kec. Ambatkwi, KAB. BOVEN DIGOEL, PAPUA SELATAN
92.09.10;Kec. Amberbaken, KAB. TAMBRAUW, PAPUA BARAT
92.09.27;Kec. Amberbaken Barat, KAB. TAMBRAUW, PAPUA BARAT
35.09.12;Kec. Ambulu, KAB. JEMBER, JAWA TIMUR
35.29.12;Kec. Ambunten, KAB. SUMENEP, JAWA TIMUR
17.07.10;Kec. Amen, KAB. LEBONG, BENGKULU
53.01.21;Kec. Amfoang Barat Daya, KAB. KUPANG, NUSA TENGGARA TIMUR
53.01.22;Kec. Amfoang Barat Laut, KAB. KUPANG, NUSA TENGGARA TIMUR
53.01.12;Kec. Amfoang Selatan, KAB. KUPANG, NUSA TENGGARA TIMUR
53.01.30;Kec. Amfoang Tengah, KAB. KUPANG, NUSA TENGGARA TIMUR
53.01.26;Kec. Amfoang Timur, KAB. KUPANG, NUSA TENGGARA TIMUR
53.01.13;Kec. Amfoang Utara, KAB. KUPANG, NUSA TENGGARA TIMUR
74.02.28;Kec. Amonggedo, KAB. KONAWE, SULAWESI TENGGARA
72.09.05;Kec. Ampana Kota, KAB. TOJO UNA UNA, SULAWESI TENGAH
72.09.04;Kec. Ampana Tete, KAB. TOJO UNA UNA, SULAWESI TENGAH
13.06.07;Kec. Ampek Angkek, KAB. AGAM, SUMATERA BARAT
13.06.13;Kec. Ampek Nagari, KAB. AGAM, SUMATERA BARAT
33.09.02;Kec. Ampel, KAB. BOYOLALI, JAWA TENGAH
33.27.11;Kec. Ampelgading, KAB. PEMALANG, JAWA TENGAH
35.07.06;Kec. Ampelgading, KAB. MALANG, JAWA TIMUR
52.71.01;Kec. Ampenan, KOTA MATARAM, NUSA TENGGARA BARAT
72.08.02;Kec. Ampibabo, KAB. PARIGI MOUTONG, SULAWESI TENGAH
95.03.11;Kec. Amuma, KAB. YAHUKIMO, PAPUA PEGUNUNGAN
94.05.23;Kec. Amungkalpia, KAB. PUNCAK, PAPUA TENGAH
63.08.04;Kec. Amuntai Selatan, KAB. HULU SUNGAI UTARA, KALIMANTAN SELATAN
63.08.05;Kec. Amuntai Tengah, KAB. HULU SUNGAI UTARA, KALIMANTAN SELATAN
63.08.06;Kec. Amuntai Utara, KAB. HULU SUNGAI UTARA, KALIMANTAN SELATAN
71.05.10;Kec. Amurang, KAB. MINAHASA SELATAN, SULAWESI UTARA
71.05.17;Kec. Amurang Barat, KAB. MINAHASA SELATAN, SULAWESI UTARA
71.05.18;Kec. Amurang Timur, KAB. MINAHASA SELATAN, SULAWESI UTARA
18.02.27;Kec. Anak Ratu Aji, KAB. LAMPUNG TENGAH, LAMPUNG
18.02.21;Kec. Anak Tuha, KAB. LAMPUNG TENGAH, LAMPUNG
95.04.36;Kec. Anawi, KAB. TOLIKARA, PAPUA PEGUNUNGAN
12.01.12;Kec. Andam Dewi, KAB. TAPANULI TENGAH, SUMATERA UTARA
91.06.14;Kec. Andey, KAB. BIAK NUMFOR, PAPUA
32.73.05;Kec. Andir, KOTA BANDUNG, JAWA BARAT
33.09.16;Kec. Andong, KAB. BOYOLALI, JAWA TENGAH
74.05.03;Kec. Andoolo, KAB. KONAWE SELATAN, SULAWESI TENGGARA
74.05.25;Kec. Andoolo Barat, KAB. KONAWE SELATAN, SULAWESI TENGGARA
74.09.09;Kec. Andowia, KAB. KONAWE UTARA, SULAWESI TENGGARA
74.05.02;Kec. Angata, KAB. KONAWE SELATAN, SULAWESI TENGGARA
74.02.24;Kec. Anggaberi, KAB. KONAWE, SULAWESI TENGGARA
74.02.40;Kec. Anggalomoare, KAB. KONAWE, SULAWESI TENGGARA
64.02.04;Kec. Anggana, KAB. KUTAI KARTANEGARA, KALIMANTAN TIMUR
73.16.04;Kec. Anggeraja, KAB. ENREKANG, SULAWESI SELATAN
92.12.01;Kec. Anggi, KAB. PEGUNUNGAN ARFAK, PAPUA BARAT
92.12.02;Kec. Anggi Gida, KAB. PEGUNUNGAN ARFAK, PAPUA BARAT
75.05.03;Kec. Anggrek, KAB. GORONTALO UTARA, GORONTALO
95.03.02;Kec. Anggruk, KAB. YAHUKIMO, PAPUA PEGUNUNGAN
91.05.04;Kec. Angkaisera, KAB. KEPULAUAN YAPEN, PAPUA
63.06.04;Kec. Angkinang, KAB. HULU SUNGAI SELATAN, KALIMANTAN SELATAN
12.03.01;Kec. Angkola Barat, KAB. TAPANULI SELATAN, SUMATERA UTARA
12.03.32;Kec. Angkola Muara Tais, KAB. TAPANULI SELATAN, SUMATERA UTARA
12.03.31;Kec. Angkola Sangkunur, KAB. TAPANULI SELATAN, SUMATERA UTARA
12.03.06;Kec. Angkola Selatan, KAB. TAPANULI SELATAN, SUMATERA UTARA
12.03.03;Kec. Angkola Timur, KAB. TAPANULI SELATAN, SUMATERA UTARA
73.24.05;Kec. Angkona, KAB. LUWU TIMUR, SULAWESI SELATAN
36.01.07;Kec. Angsana, KAB. PANDEGLANG, BANTEN
63.10.09;Kec. Angsana, KAB. TANAH BUMBU, KALIMANTAN SELATAN
93.01.13;Kec. Animha, KAB. MERAUKE, PAPUA SELATAN
32.12.23;Kec. Anjatan, KAB. INDRAMAYU, JAWA BARAT
63.04.04;Kec. Anjir Muara, KAB. BARITO KUALA, KALIMANTAN SELATAN
63.04.03;Kec. Anjir Pasar, KAB. BARITO KUALA, KALIMANTAN SELATAN
61.02.16;Kec. Anjongan, KAB. MEMPAWAH, KALIMANTAN BARAT
91.05.15;Kec. Anotaurei, KAB. KEPULAUAN YAPEN, PAPUA
76.04.13;Kec. Anreapi, KAB. POLEWALI MANDAR, SULAWESI BARAT
62.02.10;Kec. Antang Kalang, KAB. KOTAWARINGIN TIMUR, KALIMANTAN TENGAH
32.73.20;Kec. Antapani, KOTA BANDUNG, JAWA BARAT
36.04.30;Kec. Anyar, KAB. SERANG, BANTEN
95.06.02;Kec. Apalapsili, KAB. YALIMO, PAPUA PEGUNUNGAN
91.10.09;Kec. Apawer Hulu, KAB. SARMI, PAPUA
94.03.03;Kec. Aradide, KAB. PANIAI, PAPUA TENGAH
32.12.19;Kec. Arahan, KAB. INDRAMAYU, JAWA BARAT
76.03.02;Kec. Aralle, KAB. MAMASA, SULAWESI BARAT
12.14.15;Kec. Aramo, KAB. NIAS SELATAN, SUMATERA UTARA
92.06.04;Kec. Aranday, KAB. TELUK BINTUNI, PAPUA BARAT
63.03.11;Kec. Aranio, KAB. BANJAR, KALIMANTAN SELATAN
32.73.24;Kec. Arcamanik, KOTA BANDUNG, JAWA BARAT
32.10.05;Kec. Argapura, KAB. MAJALENGKA, JAWA BARAT
33.73.03;Kec. Argomulyo, KOTA SALATIGA, JAWA TENGAH
92.03.13;Kec. Arguni, KAB. FAK FAK, PAPUA BARAT
93.02.09;Kec. Arimop, KAB. BOVEN DIGOEL, PAPUA SELATAN
35.09.22;Kec. Arjasa, KAB. JEMBER, JAWA TIMUR
35.12.11;Kec. Arjasa, KAB. SITUBONDO, JAWA TIMUR
35.29.24;Kec. Arjasa, KAB. SUMENEP, JAWA TIMUR
32.04.16;Kec. Arjasari, KAB. BANDUNG, JAWA BARAT
32.09.24;Kec. Arjawinangun, KAB. CIREBON, JAWA BARAT
35.01.06;Kec. Arjosari, KAB. PACITAN, JAWA TIMUR
17.03.21;Kec. Arma Jaya, KAB. BENGKULU UTARA, BENGKULU
92.06.16;Kec. Aroba, KAB. TELUK BINTUNI, PAPUA BARAT
11.05.07;Kec. Arongan Lambalek, KAB. ACEH BARAT, ACEH
35.26.05;Kec. Arosbaya, KAB. BANGKALAN, JAWA TIMUR
12.03.14;Kec. Arse, KAB. TAPANULI SELATAN, SUMATERA UTARA
91.11.02;Kec. Arso, KAB. KEEROM, PAPUA
91.11.08;Kec. Arso Barat, KAB. KEEROM, PAPUA
91.11.06;Kec. Arso Timur, KAB. KEEROM, PAPUA
81.07.02;Kec. Aru Selatan, KAB. KEPULAUAN ARU, MALUKU
81.07.09;Kec. Aru Selatan Timur, KAB. KEPULAUAN ARU, MALUKU
81.07.10;Kec. Aru Selatan Utara, KAB. KEPULAUAN ARU, MALUKU
81.07.03;Kec. Aru Tengah, KAB. KEPULAUAN ARU, MALUKU
81.07.08;Kec. Aru Tengah Selatan, KAB. KEPULAUAN ARU, MALUKU
81.07.07;Kec. Aru Tengah Timur, KAB. KEPULAUAN ARU, MALUKU
81.07.04;Kec. Aru Utara, KAB. KEPULAUAN ARU, MALUKU
81.07.05;Kec. Aru Utara Timur Batuley, KAB. KEPULAUAN ARU, MALUKU
73.04.09;Kec. Arungkeke, KAB. JENEPONTO, SULAWESI SELATAN
62.01.02;Kec. Arut Selatan, KAB. KOTAWARINGIN BARAT, KALIMANTAN TENGAH
62.01.04;Kec. Arut Utara, KAB. KOTAWARINGIN BARAT, KALIMANTAN TENGAH
52.72.03;Kec. Asakota, KOTA BIMA, NUSA TENGGARA BARAT
13.10.10;Kec. Asam Jujuhan, KAB. DHARMASRAYA, SUMATERA BARAT
35.78.28;Kec. Asem Rowo, KOTA SURABAYA, JAWA TIMUR
35.12.13;Kec. Asembagus, KAB. SITUBONDO, JAWA TIMUR
74.09.01;Kec. Asera, KAB. KONAWE UTARA, SULAWESI TENGGARA
92.09.15;Kec. Ases, KAB. TAMBRAUW, PAPUA BARAT
74.02.31;Kec. Asinua, KAB. KONAWE, SULAWESI TENGGARA
95.01.03;Kec. Asologaima, KAB. JAYAWIJAYA, PAPUA PEGUNUNGAN
95.01.09;Kec. Asolokobal, KAB. JAYAWIJAYA, PAPUA PEGUNUNGAN
95.01.36;Kec. Asotipo, KAB. JAYAWIJAYA, PAPUA PEGUNUNGAN
75.01.21;Kec. Asparaga, KAB. GORONTALO, GORONTALO
93.03.06;Kec. Assue, KAB. MAPPI, PAPUA SELATAN
63.03.07;Kec. Astambul, KAB. BANJAR, KALIMANTAN SELATAN
32.73.10;Kec. Astana Anyar, KOTA BANDUNG, JAWA BARAT
32.09.10;Kec. Astanajapura, KAB. CIREBON, JAWA BARAT
93.04.21;Kec. Aswi, KAB. ASMAT, PAPUA SELATAN
53.13.02;Kec. Atadei, KAB. LEMBATA, NUSA TENGGARA TIMUR
53.04.21;Kec. Atambua Barat, KAB. BELU, NUSA TENGGARA TIMUR
53.04.22;Kec. Atambua Selatan, KAB. BELU, NUSA TENGGARA TIMUR
75.05.01;Kec. Atinggola, KAB. GORONTALO UTARA, GORONTALO
93.04.02;Kec. Atsj, KAB. ASMAT, PAPUA SELATAN
11.04.18;Kec. Atu Lintang, KAB. ACEH TENGAH, ACEH
13.75.03;Kec. Aur Birugo Tigo Baleh, KOTA BUKITTINGGI, SUMATERA BARAT
73.26.21;Kec. Awan Rante Karua, KAB. TORAJA UTARA, SULAWESI SELATAN
62.13.04;Kec. Awang, KAB. BARITO TIMUR, KALIMANTAN TENGAH
73.08.16;Kec. Awangpone, KAB. BONE, SULAWESI SELATAN
63.11.03;Kec. Awayan, KAB. BALANGAN, KALIMANTAN SELATAN
94.03.22;Kec. Aweida, KAB. PANIAI, PAPUA TENGAH
95.04.42;Kec. Aweku, KAB. TOLIKARA, PAPUA PEGUNUNGAN
95.07.21;Kec. Awina, KAB. LANNY JAYA, PAPUA PEGUNUNGAN
95.02.18;Kec. Awinbon, KAB. PEGUNUNGAN BINTANG, PAPUA PEGUNUNGAN
93.04.22;Kec. Awyu, KAB. ASMAT, PAPUA SELATAN
33.05.01;Kec. Ayah, KAB. KEBUMEN, JAWA TENGAH
92.10.08;Kec. Ayamaru, KAB. MAYBRAT, PAPUA BARAT
92.10.21;Kec. Ayamaru Barat, KAB. MAYBRAT, PAPUA BARAT
92.10.16;Kec. Ayamaru Jaya, KAB. MAYBRAT, PAPUA BARAT
92.10.15;Kec. Ayamaru Selatan, KAB. MAYBRAT, PAPUA BARAT
92.10.17;Kec. Ayamaru Selatan Jaya, KAB. MAYBRAT, PAPUA BARAT
92.10.20;Kec. Ayamaru Tengah, KAB. MAYBRAT, PAPUA BARAT
92.10.10;Kec. Ayamaru Timur, KAB. MAYBRAT, PAPUA BARAT
92.10.18;Kec. Ayamaru Timur Selatan, KAB. MAYBRAT, PAPUA BARAT
92.10.09;Kec. Ayamaru Utara, KAB. MAYBRAT, PAPUA BARAT
92.10.19;Kec. Ayamaru Utara Timur, KAB. MAYBRAT, PAPUA BARAT
92.05.24;Kec. Ayau, KAB. RAJA AMPAT, PAPUA BARAT
93.04.18;Kec. Ayip, KAB. ASMAT, PAPUA SELATAN
95.07.22;Kec. Ayumnati, KAB. LANNY JAYA, PAPUA PEGUNUNGAN
62.02.05;Kec. Baamang, KAB. KOTAWARINGIN TIMUR, KALIMANTAN TENGAH
35.02.16;Kec. Babadan, KAB. PONOROGO, JAWA TIMUR
11.12.06;Kec. Babah Rot, KAB. ACEH BARAT DAYA, ACEH
32.09.05;Kec. Babakan, KAB. CIREBON, JAWA BARAT
32.73.03;Kec. Babakan Ciparay, KOTA BANDUNG, JAWA BARAT
32.01.05;Kec. Babakan Madang, KAB. BOGOR, JAWA BARAT
32.14.12;Kec. Babakancikao, KAB. PURWAKARTA, JAWA BARAT
12.05.14;Kec. Babalan, KAB. LANGKAT, SUMATERA UTARA
35.24.05;Kec. Babat, KAB. LAMONGAN, JAWA TIMUR
16.06.14;Kec. Babat Supat, KAB. MUSI BANYUASIN, SUMATERA SELATAN
16.06.06;Kec. Babat Toman, KAB. MUSI BANYUASIN, SUMATERA SELATAN
32.16.02;Kec. Babelan, KAB. BEKASI, JAWA BARAT
63.08.02;Kec. Babirik, KAB. HULU SUNGAI UTARA, KALIMANTAN SELATAN
92.06.03;Kec. Babo, KAB. TELUK BINTUNI, PAPUA BARAT
11.02.06;Kec. Babul Makmur, KAB. ACEH TENGGARA, ACEH
11.02.11;Kec. Babul Rahmah, KAB. ACEH TENGGARA, ACEH
64.09.03;Kec. Babulu, KAB. PENAJAM PASER UTARA, KALIMANTAN TIMUR
11.02.04;Kec. Babussalam, KAB. ACEH TENGGARA, ACEH
82.04.08;Kec. Bacan, KAB. HALMAHERA SELATAN, MALUKU UTARA
82.04.09;Kec. Bacan Barat, KAB. HALMAHERA SELATAN, MALUKU UTARA
82.04.14;Kec. Bacan Barat Utara, KAB. HALMAHERA SELATAN, MALUKU UTARA
82.04.17;Kec. Bacan Selatan, KAB. HALMAHERA SELATAN, MALUKU UTARA
82.04.07;Kec. Bacan Timur, KAB. HALMAHERA SELATAN, MALUKU UTARA
82.04.21;Kec. Bacan Timur Selatan, KAB. HALMAHERA SELATAN, MALUKU UTARA
82.04.22;Kec. Bacan Timur Tengah, KAB. HALMAHERA SELATAN, MALUKU UTARA
73.72.01;Kec. Bacukiki, KOTA PARE PARE, SULAWESI SELATAN
73.72.04;Kec. Bacukiki Barat, KOTA PARE PARE, SULAWESI SELATAN
11.02.05;Kec. Badar, KAB. ACEH TENGGARA, ACEH
35.06.26;Kec. Badas, KAB. KEDIRI, JAWA TIMUR
19.02.05;Kec. Badau, KAB. BELITUNG, KEPULAUAN BANGKA BELITUNG
61.06.14;Kec. Badau, KAB. KAPUAS HULU, KALIMANTAN BARAT
35.02.13;Kec. Badegan, KAB. PONOROGO, JAWA TIMUR
12.01.15;Kec. Badiri, KAB. TAPANULI TENGAH, SUMATERA UTARA
33.19.07;Kec. Bae, KAB. KUDUS, JAWA TENGAH
73.22.11;Kec. Baebunta, KAB. LUWU UTARA, SULAWESI SELATAN
73.22.14;Kec. Baebunta Selatan, KAB. LUWU UTARA, SULAWESI SELATAN
14.07.05;Kec. Bagan Sinembah, KAB. ROKAN HILIR, RIAU
14.07.17;Kec. Bagan Sinembah Raya, KAB. ROKAN HILIR, RIAU
33.06.04;Kec. Bagelen, KAB. PURWOREJO, JAWA TENGAH
35.18.14;Kec. Bagor, KAB. NGANJUK, JAWA TIMUR
81.71.03;Kec. Baguala, KOTA AMBON, MALUKU
92.01.44;Kec. Bagun, KAB. SORONG, PAPUA BARAT
15.05.10;Kec. Bahar Selatan, KAB. MUARO JAMBI, JAMBI
15.05.09;Kec. Bahar Utara, KAB. MUARO JAMBI, JAMBI
65.02.11;Kec. Bahau Hulu, KAB. MALINAU, KALIMANTAN UTARA
72.06.10;Kec. Bahodopi, KAB. MOROWALI, SULAWESI TENGAH
12.05.01;Kec. Bahorok, KAB. LANGKAT, SUMATERA UTARA
18.08.05;Kec. Bahuga, KAB. WAY KANAN, LAMPUNG
74.05.20;Kec. Baito, KAB. KONAWE SELATAN, SULAWESI TENGGARA
11.71.01;Kec. Baiturrahman, KOTA BANDA ACEH, ACEH
11.06.20;Kec. Baitussalam, KAB. ACEH BESAR, ACEH
53.09.06;Kec. Bajawa, KAB. NGADA, NUSA TENGGARA TIMUR
53.09.15;Kec. Bajawa Utara, KAB. NGADA, NUSA TENGGARA TIMUR
73.06.02;Kec. Bajeng, KAB. GOWA, SULAWESI SELATAN
73.06.18;Kec. Bajeng Barat, KAB. GOWA, SULAWESI SELATAN
12.76.04;Kec. Bajenis, KOTA TEBING TINGGI, SUMATERA UTARA
73.17.04;Kec. Bajo, KAB. LUWU, SULAWESI SELATAN
73.17.20;Kec. Bajo Barat, KAB. LUWU, SULAWESI SELATAN
15.04.07;Kec. Bajubang, KAB. BATANGHARI, JAMBI
63.01.10;Kec. Bajuin, KAB. TANAH LAUT, KALIMANTAN SELATAN
19.01.06;Kec. Bakam, KAB. BANGKA, KEPULAUAN BANGKA BELITUNG
63.05.07;Kec. Bakarangan, KAB. TAPIN, KALIMANTAN SELATAN
18.01.21;Kec. Bakauheni, KAB. LAMPUNG SELATAN, LAMPUNG
33.11.10;Kec. Baki, KAB. SUKOHARJO, JAWA TENGAH
11.01.01;Kec. Bakongan, KAB. ACEH SELATAN, ACEH
11.01.15;Kec. Bakongan Timur, KAB. ACEH SELATAN, ACEH
12.16.03;Kec. Baktiraja, KAB. HUMBANG HASUNDUTAN, SUMATERA UTARA
11.08.01;Kec. Baktiya, KAB. ACEH UTARA, ACEH
11.08.19;Kec. Baktiya Barat, KAB. ACEH UTARA, ACEH
63.04.10;Kec. Bakumpai, KAB. BARITO KUALA, KALIMANTAN SELATAN
35.05.05;Kec. Bakung, KAB. BLITAR, JAWA TIMUR
21.04.13;Kec. Bakung Serumpun, KAB. LINGGA, KEPULAUAN RIAU
72.03.12;Kec. Balaesang, KAB. DONGGALA, SULAWESI TENGAH
72.03.31;Kec. Balaesang Tanjung, KAB. DONGGALA, SULAWESI TENGAH
61.03.12;Kec. Balai, KAB. SANGGAU, KALIMANTAN BARAT
14.07.18;Kec. Balai Jaya, KAB. ROKAN HILIR, RIAU
62.08.03;Kec. Balai Riam, KAB. SUKAMARA, KALIMANTAN TENGAH
76.04.12;Kec. Balanipa, KAB. POLEWALI MANDAR, SULAWESI BARAT
72.01.06;Kec. Balantak, KAB. BANGGAI, SULAWESI TENGAH
72.01.18;Kec. Balantak Selatan, KAB. BANGGAI, SULAWESI TENGAH
72.01.19;Kec. Balantak Utara, KAB. BANGGAI, SULAWESI TENGAH
33.28.04;Kec. Balapulang, KAB. TEGAL, JAWA TENGAH
36.03.01;Kec. Balaraja, KAB. TANGERANG, BANTEN
32.04.32;Kec. Baleendah, KAB. BANDUNG, JAWA BARAT
35.22.13;Kec. Balen, KAB. BOJONEGORO, JAWA TIMUR
35.19.10;Kec. Balerejo, KAB. MADIUN, JAWA TIMUR
12.12.01;Kec. Balige, KAB. TOBA, SUMATERA UTARA
18.04.04;Kec. Balik Bukit, KAB. LAMPUNG BARAT, LAMPUNG
64.71.02;Kec. Balikpapan Barat, KOTA BALIKPAPAN, KALIMANTAN TIMUR
64.71.06;Kec. Balikpapan Kota, KOTA BALIKPAPAN, KALIMANTAN TIMUR
64.71.05;Kec. Balikpapan Selatan, KOTA BALIKPAPAN, KALIMANTAN TIMUR
64.71.04;Kec. Balikpapan Tengah, KOTA BALIKPAPAN, KALIMANTAN TIMUR
64.71.01;Kec. Balikpapan Timur, KOTA BALIKPAPAN, KALIMANTAN TIMUR
64.71.03;Kec. Balikpapan Utara, KOTA BALIKPAPAN, KALIMANTAN TIMUR
95.07.07;Kec. Balingga, KAB. LANNY JAYA, PAPUA PEGUNUNGAN
95.07.26;Kec. Balingga Barat, KAB. LANNY JAYA, PAPUA PEGUNUNGAN
72.08.15;Kec. Balinggi, KAB. PARIGI MOUTONG, SULAWESI TENGAH
76.03.12;Kec. Balla, KAB. MAMASA, SULAWESI BARAT
73.10.05;Kec. Balocci, KAB. PANGKAJENE KEPULAUAN, SULAWESI SELATAN
35.02.11;Kec. Balong, KAB. PONOROGO, JAWA TIMUR
32.12.14;Kec. Balongan, KAB. INDRAMAYU, JAWA BARAT
35.15.12;Kec. Balongbendo, KAB. SIDOARJO, JAWA TIMUR
35.25.02;Kec. Balongpanggang, KAB. GRESIK, JAWA TIMUR
35.09.10;Kec. Balung, KAB. JEMBER, JAWA TIMUR
73.11.07;Kec. Balusu, KAB. BARRU, SULAWESI SELATAN
73.26.10;Kec. Balusu, KAB. TORAJA UTARA, SULAWESI SELATAN
76.01.10;Kec. Bambaira, KAB. PASANGKAYU, SULAWESI BARAT
76.01.01;Kec. Bambalamotu, KAB. PASANGKAYU, SULAWESI BARAT
76.03.11;Kec. Bambang, KAB. MAMASA, SULAWESI BARAT
34.02.05;Kec. Bambanglipuro, KAB. BANTUL, DAERAH ISTIMEWA YOGYAKARTA
11.02.03;Kec. Bambel, KAB. ACEH TENGGARA, ACEH
93.03.13;Kec. Bamgi, KAB. MAPPI, PAPUA SELATAN
92.09.14;Kec. Bamusbama, KAB. TAMBRAUW, PAPUA BARAT
62.11.04;Kec. Banama Tingang, KAB. PULANG PISAU, KALIMANTAN TENGAH
72.03.08;Kec. Banawa, KAB. DONGGALA, SULAWESI TENGAH
72.03.18;Kec. Banawa Selatan, KAB. DONGGALA, SULAWESI TENGAH
72.03.27;Kec. Banawa Tengah, KAB. DONGGALA, SULAWESI TENGAH
33.22.16;Kec. Bancak, KAB. SEMARANG, JAWA TENGAH
35.23.04;Kec. Bancar, KAB. TUBAN, JAWA TIMUR
81.01.09;Kec. Banda, KAB. MALUKU TENGAH, MALUKU
11.03.15;Kec. Banda Alam, KAB. ACEH TIMUR, ACEH
11.08.26;Kec. Banda Baro, KAB. ACEH UTARA, ACEH
11.16.09;Kec. Banda Mulia, KAB. ACEH TAMIANG, ACEH
11.71.07;Kec. Banda Raya, KOTA BANDA ACEH, ACEH
11.73.02;Kec. Banda Sakti, KOTA LHOKSEUMAWE, ACEH
11.17.04;Kec. Bandar, KAB. BENER MERIAH, ACEH
12.08.23;Kec. Bandar, KAB. SIMALUNGUN, SUMATERA UTARA
33.25.02;Kec. Bandar, KAB. BATANG, JAWA TENGAH
35.01.08;Kec. Bandar, KAB. PACITAN, JAWA TIMUR
11.18.06;Kec. Bandar Baru, KAB. PIDIE JAYA, ACEH
11.18.04;Kec. Bandar Dua, KAB. PIDIE JAYA, ACEH
12.08.22;Kec. Bandar Huluan, KAB. SIMALUNGUN, SUMATERA UTARA
12.18.06;Kec. Bandar Khalipah, KAB. SERDANG BEDAGAI, SUMATERA UTARA
14.03.14;Kec. Bandar Laksamana, KAB. BENGKALIS, RIAU
12.08.24;Kec. Bandar Masilam, KAB. SIMALUNGUN, SUMATERA UTARA
18.02.18;Kec. Bandar Mataram, KAB. LAMPUNG TENGAH, LAMPUNG
18.06.25;Kec. Bandar Negeri Semuong, KAB. TANGGAMUS, LAMPUNG
18.04.23;Kec. Bandar Negeri Suoh, KAB. LAMPUNG BARAT, LAMPUNG
12.09.17;Kec. Bandar Pasir Mandoge, KAB. ASAHAN, SUMATERA UTARA
14.05.12;Kec. Bandar Petalangan, KAB. PELALAWAN, RIAU
12.09.15;Kec. Bandar Pulau, KAB. ASAHAN, SUMATERA UTARA
11.16.10;Kec. Bandar Pusaka, KAB. ACEH TAMIANG, ACEH
14.05.11;Kec. Bandar Sei Kijang, KAB. PELALAWAN, RIAU
18.07.15;Kec. Bandar Sribhawono, KAB. LAMPUNG TIMUR, LAMPUNG
18.02.26;Kec. Bandar Surabaya, KAB. LAMPUNG TENGAH, LAMPUNG
35.17.18;Kec. Bandarkedungmulyo, KAB. JOMBANG, JAWA TIMUR
16.09.03;Kec. Banding Agung, KAB. OGAN KOMERING ULU SELATAN, SUMATERA SELATAN
33.08.14;Kec. Bandongan, KAB. MAGELANG, JAWA TENGAH
35.04.17;Kec. Bandung, KAB. TULUNGAGUNG, JAWA TIMUR
36.04.34;Kec. Bandung, KAB. SERANG, BANTEN
32.73.21;Kec. Bandung Kidul, KOTA BANDUNG, JAWA BARAT
32.73.15;Kec. Bandung Kulon, KOTA BANDUNG, JAWA BARAT
32.73.09;Kec. Bandung Wetan, KOTA BANDUNG, JAWA BARAT
33.22.20;Kec. Bandungan, KAB. SEMARANG, JAWA TENGAH
17.09.10;Kec. Bang Haji, KAB. BENGKULU TENGAH, BENGKULU
76.05.01;Kec. Banggae, KAB. MAJENE, SULAWESI BARAT
76.05.08;Kec. Banggae Timur, KAB. MAJENE, SULAWESI BARAT
72.11.01;Kec. Banggai, KAB. BANGGAI LAUT, SULAWESI TENGAH
72.11.06;Kec. Banggai Selatan, KAB. BANGGAI LAUT, SULAWESI TENGAH
72.11.07;Kec. Banggai Tengah, KAB. BANGGAI LAUT, SULAWESI TENGAH
72.11.02;Kec. Banggai Utara, KAB. BANGGAI LAUT, SULAWESI TENGAH
35.14.14;Kec. Bangil, KAB. PASURUAN, JAWA TIMUR
35.23.03;Kec. Bangilan, KAB. TUBAN, JAWA TIMUR
73.04.01;Kec. Bangkala, KAB. JENEPONTO, SULAWESI SELATAN
73.04.06;Kec. Bangkala Barat, KAB. JENEPONTO, SULAWESI SELATAN
35.26.01;Kec. Bangkalan, KAB. BANGKALAN, JAWA TIMUR
