16.13.04;Kec. Rawas Ilir, KAB. MUSI RAWAS UTARA, SUMATERA SELATAN
16.13.02;Kec. Rawas Ulu, KAB. MUSI RAWAS UTARA, SUMATERA SELATAN
12.08.29;Kec. Raya, KAB. SIMALUNGUN, SUMATERA UTARA
12.08.07;Kec. Raya Kahean, KAB. SIMALUNGUN, SUMATERA UTARA
33.25.04;Kec. Reban, KAB. BATANG, JAWA TENGAH
18.08.09;Kec. Rebang Tangkas, KAB. WAY KANAN, LAMPUNG
32.73.11;Kec. Regol, KOTA BANDUNG, JAWA BARAT
35.14.23;Kec. Rejoso, KAB. PASURUAN, JAWA TIMUR
35.18.16;Kec. Rejoso, KAB. NGANJUK, JAWA TIMUR
35.04.13;Kec. Rejotangan, KAB. TULUNGAGUNG, JAWA TIMUR
33.03.13;Kec. Rembang, KAB. PURBALINGGA, JAWA TENGAH
33.17.10;Kec. Rembang, KAB. REMBANG, JAWA TENGAH
35.14.15;Kec. Rembang, KAB. PASURUAN, JAWA TIMUR
71.02.08;Kec. Remboken, KAB. MINAHASA, SULAWESI UTARA
73.18.20;Kec. Rembon, KAB. TANA TORAJA, SULAWESI SELATAN
15.06.08;Kec. Renah Mendaluh, KAB. TANJUNG JABUNG BARAT, JAMBI
15.02.19;Kec. Renah Pamenang, KAB. MERANGIN, JAMBI
15.02.16;Kec. Renah Pembarap, KAB. MERANGIN, JAMBI
51.07.01;Kec. Rendang, KAB. KARANGASEM, BALI
32.15.06;Kec. Rengasdengklok, KAB. KARAWANG, JAWA BARAT
14.02.01;Kec. Rengat, KAB. INDRAGIRI HULU, RIAU
14.02.02;Kec. Rengat Barat, KAB. INDRAGIRI HULU, RIAU
35.23.14;Kec. Rengel, KAB. TUBAN, JAWA TIMUR
53.10.11;Kec. Reok, KAB. MANGGARAI, NUSA TENGGARA TIMUR
53.10.16;Kec. Reok Barat, KAB. MANGGARAI, NUSA TENGGARA TIMUR
14.04.01;Kec. Reteh, KAB. INDRAGIRI HILIR, RIAU
52.04.21;Kec. Rhee, KAB. SUMBAWA, NUSA TENGGARA BARAT
19.01.07;Kec. Riau Silip, KAB. BANGKA, KEPULAUAN BANGKA BELITUNG
11.13.03;Kec. Rikit Gaib, KAB. GAYO LUES, ACEH
73.02.10;Kec. Rilauale, KAB. BULUKUMBA, SULAWESI SELATAN
14.07.04;Kec. Rimba Melintang, KAB. ROKAN HILIR, RIAU
15.09.04;Kec. Rimbo Bujang, KAB. TEBO, JAMBI
15.09.08;Kec. Rimbo Ilir, KAB. TEBO, JAMBI
17.07.05;Kec. Rimbo Pengadang, KAB. LEBONG, BENGKULU
15.08.13;Kec. Rimbo Tengah, KAB. BUNGO, JAMBI
15.09.07;Kec. Rimbo Ulu, KAB. TEBO, JAMBI
53.11.09;Kec. Rindi, KAB. SUMBA TIMUR, NUSA TENGGARA TIMUR
73.26.04;Kec. Rindingallo, KAB. TORAJA UTARA, SULAWESI SELATAN
33.24.18;Kec. Ringinarum, KAB. KENDAL, JAWA TENGAH
35.06.23;Kec. Ringinrejo, KAB. KEDIRI, JAWA TIMUR
53.21.05;Kec. Rinhat, KAB. MALAKA, NUSA TENGGARA TIMUR
72.03.04;Kec. Rio Pakava, KAB. DONGGALA, SULAWESI TENGAH
91.15.07;Kec. Risei Sayati, KAB. WAROPEN, PAPUA
53.09.09;Kec. Riung, KAB. NGADA, NUSA TENGGARA TIMUR
53.09.14;Kec. Riung Barat, KAB. NGADA, NUSA TENGGARA TIMUR
35.27.10;Kec. Robatal, KAB. SAMPANG, JAWA TIMUR
35.10.13;Kec. Rogojampi, KAB. BANYUWANGI, JAWA TIMUR
14.06.02;Kec. Rokan IV Koto, KAB. ROKAN HULU, RIAU
32.17.13;Kec. Rongga, KAB. BANDUNG BARAT, JAWA BARAT
12.17.07;Kec. Ronggur Nihuta, KAB. SAMOSIR, SUMATERA UTARA
73.22.05;Kec. Rongkong, KAB. LUWU UTARA, SULAWESI SELATAN
34.03.11;Kec. Rongkop, KAB. GUNUNGKIDUL, DAERAH ISTIMEWA YOGYAKARTA
92.07.10;Kec. Roon, KAB. TELUK WONDAMA, PAPUA BARAT
52.04.11;Kec. Ropang, KAB. SUMBAWA, NUSA TENGGARA BARAT
92.07.11;Kec. Roswar, KAB. TELUK WONDAMA, PAPUA BARAT
53.14.07;Kec. Rote Barat, KAB. ROTE NDAO, NUSA TENGGARA TIMUR
53.14.01;Kec. Rote Barat Daya, KAB. ROTE NDAO, NUSA TENGGARA TIMUR
53.14.02;Kec. Rote Barat Laut, KAB. ROTE NDAO, NUSA TENGGARA TIMUR
53.14.08;Kec. Rote Selatan, KAB. ROTE NDAO, NUSA TENGGARA TIMUR
53.14.04;Kec. Rote Tengah, KAB. ROTE NDAO, NUSA TENGGARA TIMUR
53.14.06;Kec. Rote Timur, KAB. ROTE NDAO, NUSA TENGGARA TIMUR
74.02.23;Kec. Routa, KAB. KONAWE, SULAWESI TENGGARA
35.08.08;Kec. Rowokangkung, KAB. LUMAJANG, JAWA TIMUR
33.05.17;Kec. Rowokele, KAB. KEBUMEN, JAWA TENGAH
33.24.16;Kec. Rowosari, KAB. KENDAL, JAWA TENGAH
35.29.15;Kec. Rubaru, KAB. SUMENEP, JAWA TIMUR
91.20.03;Kec. Rufaer, KAB. MAMBERAMO RAYA, PAPUA
14.71.12;Kec. Rumbai, KOTA PEKANBARU, RIAU
14.71.06;Kec. Rumbai Barat, KOTA PEKANBARU, RIAU
14.71.15;Kec. Rumbai Timur, KOTA PEKANBARU, RIAU
92.07.06;Kec. Rumberpon, KAB. TELUK WONDAMA, PAPUA BARAT
18.02.09;Kec. Rumbia, KAB. LAMPUNG TENGAH, LAMPUNG
73.04.10;Kec. Rumbia, KAB. JENEPONTO, SULAWESI SELATAN
74.06.04;Kec. Rumbia, KAB. BOMBANA, SULAWESI TENGGARA
74.06.18;Kec. Rumbia Tengah, KAB. BOMBANA, SULAWESI TENGGARA
14.01.14;Kec. Rumbio Jaya, KAB. KAMPAR, RIAU
32.01.18;Kec. Rumpin, KAB. BOGOR, JAWA BARAT
11.75.03;Kec. Rundeng, KOTA SUBULUSSALAM, ACEH
62.10.05;Kec. Rungan, KAB. GUNUNG MAS, KALIMANTAN TENGAH
62.10.12;Kec. Rungan Barat, KAB. GUNUNG MAS, KALIMANTAN TENGAH
62.10.10;Kec. Rungan Hulu, KAB. GUNUNG MAS, KALIMANTAN TENGAH
35.78.03;Kec. Rungkut, KOTA SURABAYA, JAWA TIMUR
16.09.14;Kec. Runjung Agung, KAB. OGAN KOMERING ULU SELATAN, SUMATERA SELATAN
14.03.10;Kec. Rupat, KAB. BENGKALIS, RIAU
14.03.11;Kec. Rupat Utara, KAB. BENGKALIS, RIAU
16.13.01;Kec. Rupit, KAB. MUSI RAWAS UTARA, SUMATERA SELATAN
11.04.21;Kec. Rusip Antara, KAB. ACEH TENGAH, ACEH
53.10.03;Kec. Ruteng, KAB. MANGGARAI, NUSA TENGGARA TIMUR
15.07.05;Kec. S a d u, KAB. TANJUNG JABUNG TIMUR, JAMBI
73.26.06;Kec. Sa'dan, KAB. TORAJA UTARA, SULAWESI SELATAN
14.08.12;Kec. Sabak Auh, KAB. SIAK, RIAU
62.71.04;Kec. Sabangau, KOTA PALANGKARAYA, KALIMANTAN TENGAH
73.13.01;Kec. Sabangparu, KAB. WAJO, SULAWESI SELATAN
73.22.04;Kec. Sabbang, KAB. LUWU UTARA, SULAWESI SELATAN
73.22.15;Kec. Sabbang Selatan, KAB. LUWU UTARA, SULAWESI SELATAN
53.20.01;Kec. Sabu Barat, KAB. SABU RAIJUA, NUSA TENGGARA TIMUR
53.20.04;Kec. Sabu Liae, KAB. SABU RAIJUA, NUSA TENGGARA TIMUR
53.20.02;Kec. Sabu Tengah, KAB. SABU RAIJUA, NUSA TENGGARA TIMUR
53.20.03;Kec. Sabu Timur, KAB. SABU RAIJUA, NUSA TENGGARA TIMUR
74.05.24;Kec. Sabulakoa, KAB. KONAWE SELATAN, SULAWESI TENGGARA
32.07.04;Kec. Sadananya, KAB. CIAMIS, JAWA BARAT
33.05.22;Kec. Sadang, KAB. KEBUMEN, JAWA TENGAH
61.02.17;Kec. Sadaniang, KAB. MEMPAWAH, KALIMANTAN BARAT
92.01.48;Kec. Saengkeduk, KAB. SORONG, PAPUA BARAT
93.04.16;Kec. Safan, KAB. ASMAT, PAPUA SELATAN
32.13.01;Kec. Sagalaherang, KAB. SUBANG, JAWA BARAT
32.02.41;Kec. Sagaranten, KAB. SUKABUMI, JAWA BARAT
32.17.16;Kec. Saguling, KAB. BANDUNG BARAT, JAWA BARAT
21.71.11;Kec. Sagulung, KOTA BATAM, KEPULAUAN RIAU
82.01.04;Kec. Sahu, KAB. HALMAHERA BARAT, MALUKU UTARA
82.01.09;Kec. Sahu Timur, KAB. HALMAHERA BARAT, MALUKU UTARA
92.04.22;Kec. Saifi, KAB. SORONG SELATAN, PAPUA BARAT
14.71.03;Kec. Sail, KOTA PEKANBARU, RIAU
12.03.05;Kec. Saipar Dolok Hole, KAB. TAPANULI SELATAN, SUMATERA UTARA
61.01.14;Kec. Sajad, KAB. SAMBAS, KALIMANTAN BARAT
61.01.09;Kec. Sajingan Besar, KAB. SAMBAS, KALIMANTAN BARAT
36.02.12;Kec. Sajira, KAB. LEBAK, BANTEN
73.13.04;Kec. Sajoanging, KAB. WAJO, SULAWESI SELATAN
36.01.14;Kec. Saketi, KAB. PANDEGLANG, BANTEN
16.71.08;Kec. Sako, KOTA PALEMBANG, SUMATERA SELATAN
52.03.02;Kec. Sakra, KAB. LOMBOK TIMUR, NUSA TENGGARA BARAT
52.03.19;Kec. Sakra Barat, KAB. LOMBOK TIMUR, NUSA TENGGARA BARAT
52.03.18;Kec. Sakra Timur, KAB. LOMBOK TIMUR, NUSA TENGGARA BARAT
11.07.17;Kec. Sakti, KAB. PIDIE, ACEH
81.01.14;Kec. Salahutu, KAB. MALUKU TENGAH, MALUKU
12.15.03;Kec. Salak, KAB. PAKPAK BHARAT, SUMATERA UTARA
33.08.04;Kec. Salam, KAB. MAGELANG, JAWA TENGAH
63.05.11;Kec. Salam Babaris, KAB. TAPIN, KALIMANTAN SELATAN
33.08.01;Kec. Salaman, KAB. MAGELANG, JAWA TENGAH
11.09.02;Kec. Salang, KAB. SIMEULUE, ACEH
12.05.02;Kec. Salapian, KAB. LANGKAT, SUMATERA UTARA
61.01.18;Kec. Salatiga, KAB. SAMBAS, KALIMANTAN BARAT
92.01.05;Kec. Salawati, KAB. SORONG, PAPUA BARAT
92.05.21;Kec. Salawati Barat, KAB. RAJA AMPAT, PAPUA BARAT
92.01.14;Kec. Salawati Selatan, KAB. SORONG, PAPUA BARAT
92.01.53;Kec. Salawati Tengah, KAB. SORONG, PAPUA BARAT
92.05.22;Kec. Salawati Tengah, KAB. RAJA AMPAT, PAPUA BARAT
92.05.04;Kec. Salawati Utara, KAB. RAJA AMPAT, PAPUA BARAT
32.06.14;Kec. Salawu, KAB. TASIKMALAYA, JAWA BARAT
33.17.04;Kec. Sale, KAB. REMBANG, JAWA TENGAH
33.29.01;Kec. Salem, KAB. BREBES, JAWA TENGAH
71.04.11;Kec. Salibabu, KAB. KEPULAUAN TALAUD, SULAWESI UTARA
13.04.10;Kec. Salimpaung, KAB. TANAH DATAR, SUMATERA BARAT
16.11.09;Kec. Saling, KAB. EMPAT LAWANG, SUMATERA SELATAN
92.04.25;Kec. Salkma, KAB. SORONG SELATAN, PAPUA BARAT
14.01.13;Kec. Salo, KAB. KAMPAR, RIAU
73.08.04;Kec. Salomekko, KAB. BONE, SULAWESI SELATAN
32.06.18;Kec. Salopa, KAB. TASIKMALAYA, JAWA BARAT
73.18.01;Kec. Saluputi, KAB. TANA TORAJA, SULAWESI SELATAN
11.01.06;Kec. Samadua, KAB. ACEH SELATAN, ACEH
11.11.01;Kec. Samalanga, KAB. BIREUEN, ACEH
61.07.02;Kec. Samalantan, KAB. BENGKAYANG, KALIMANTAN BARAT
32.05.07;Kec. Samarang, KAB. GARUT, JAWA BARAT
64.72.04;Kec. Samarinda Ilir, KOTA SAMARINDA, KALIMANTAN TIMUR
64.72.09;Kec. Samarinda Kota, KOTA SAMARINDA, KALIMANTAN TIMUR
64.72.02;Kec. Samarinda Seberang, KOTA SAMARINDA, KALIMANTAN TIMUR
64.72.03;Kec. Samarinda Ulu, KOTA SAMARINDA, KALIMANTAN TIMUR
64.72.05;Kec. Samarinda Utara, KOTA SAMARINDA, KALIMANTAN TIMUR
11.05.05;Kec. Samatiga, KAB. ACEH BARAT, ACEH
74.01.20;Kec. Samaturu, KAB. KOLAKA, SULAWESI TENGGARA
64.03.03;Kec. Sambaliung, KAB. BERAU, KALIMANTAN TIMUR
61.01.01;Kec. Sambas, KAB. SAMBAS, KALIMANTAN BARAT
52.03.10;Kec. Sambelia, KAB. LOMBOK TIMUR, NUSA TENGGARA BARAT
35.24.11;Kec. Sambeng, KAB. LAMONGAN, JAWA TIMUR
33.09.10;Kec. Sambi, KAB. BOYOLALI, JAWA TENGAH
53.19.04;Kec. Sambi Rampas, KAB. MANGGARAI TIMUR, NUSA TENGGARA TIMUR
35.78.31;Kec. Sambikerep, KOTA SURABAYA, JAWA TIMUR
33.14.05;Kec. Sambirejo, KAB. SRAGEN, JAWA TENGAH
35.02.04;Kec. Sambit, KAB. PONOROGO, JAWA TIMUR
64.02.13;Kec. Samboja, KAB. KUTAI KARTANEGARA, KALIMANTAN TIMUR
33.16.06;Kec. Sambong, KAB. BLORA, JAWA TENGAH
63.03.16;Kec. Sambung Makmur, KAB. BANJAR, KALIMANTAN SELATAN
33.14.07;Kec. Sambungmacan, KAB. SRAGEN, JAWA TENGAH
64.72.07;Kec. Sambutan, KOTA SAMARINDA, KALIMANTAN TIMUR
95.03.05;Kec. Samenage, KAB. YAHUKIMO, PAPUA PEGUNUNGAN
34.01.11;Kec. Samigaluh, KAB. KULON PROGO, DAERAH ISTIMEWA YOGYAKARTA
91.06.12;Kec. Samofa, KAB. BIAK NUMFOR, PAPUA
76.02.08;Kec. Sampaga, KAB. MAMUJU, SULAWESI BARAT
63.02.12;Kec. Sampanahan, KAB. KOTABARU, KALIMANTAN SELATAN
33.01.17;Kec. Sampang, KAB. CILACAP, JAWA TENGAH
35.27.03;Kec. Sampang, KAB. SAMPANG, JAWA TIMUR
74.02.05;Kec. Sampara, KAB. KONAWE, SULAWESI TENGGARA
11.14.04;Kec. Sampoi Niet, KAB. ACEH JAYA, ACEH
74.15.02;Kec. Sampolawa, KAB. BUTON SELATAN, SULAWESI TENGGARA
35.02.14;Kec. Sampung, KAB. PONOROGO, JAWA TIMUR
11.08.08;Kec. Samudera, KAB. ACEH UTARA, ACEH
62.06.06;Kec. Sanaman Mantikei, KAB. KATINGAN, KALIMANTAN TENGAH
82.05.02;Kec. Sanana, KAB. KEPULAUAN SULA, MALUKU UTARA
82.05.18;Kec. Sanana Utara, KAB. KEPULAUAN SULA, MALUKU UTARA
35.05.07;Kec. Sanankulon, KAB. BLITAR, JAWA TIMUR
35.72.03;Kec. Sananwetan, KOTA BLITAR, JAWA TIMUR
61.04.05;Kec. Sandai, KAB. KETAPANG, KALIMANTAN BARAT
64.08.11;Kec. Sandaran, KAB. KUTAI TIMUR, KALIMANTAN TIMUR
34.02.02;Kec. Sanden, KAB. BANTUL, DAERAH ISTIMEWA YOGYAKARTA
52.71.06;Kec. Sandubaya, KOTA MATARAM, NUSA TENGGARA BARAT
71.01.05;Kec. Sang Tombolang, KAB. BOLAANG MONGONDOW, SULAWESI UTARA
16.06.05;Kec. Sanga Desa, KAB. MUSI BANYUASIN, SUMATERA SELATAN
64.02.15;Kec. Sanga Sanga, KAB. KUTAI KARTANEGARA, KALIMANTAN TIMUR
73.18.13;Kec. Sangalla, KAB. TANA TORAJA, SULAWESI SELATAN
73.18.33;Kec. Sangalla Selatan, KAB. TANA TORAJA, SULAWESI SELATAN
73.18.34;Kec. Sangalla Utara, KAB. TANA TORAJA, SULAWESI SELATAN
64.08.12;Kec. Sangatta Selatan, KAB. KUTAI TIMUR, KALIMANTAN TIMUR
64.08.04;Kec. Sangatta Utara, KAB. KUTAI TIMUR, KALIMANTAN TIMUR
73.26.07;Kec. Sanggalangi, KAB. TORAJA UTARA, SULAWESI SELATAN
52.06.09;Kec. Sanggar, KAB. BIMA, NUSA TENGGARA BARAT
61.07.06;Kec. Sanggau Ledo, KAB. BENGKAYANG, KALIMANTAN BARAT
74.14.07;Kec. Sangia Wambulu, KAB. BUTON TENGAH, SULAWESI TENGGARA
13.11.01;Kec. Sangir, KAB. SOLOK SELATAN, SUMATERA BARAT
13.11.07;Kec. Sangir Balai Janggo, KAB. SOLOK SELATAN, SUMATERA BARAT
13.11.05;Kec. Sangir Batang Hari, KAB. SOLOK SELATAN, SUMATERA BARAT
13.11.04;Kec. Sangir Jujuan, KAB. SOLOK SELATAN, SUMATERA BARAT
35.25.17;Kec. Sangkapura, KAB. GRESIK, JAWA TIMUR
71.08.01;Kec. Sangkub, KAB. BOLAANG MONGONDOW UTARA, SULAWESI UTARA
64.08.05;Kec. Sangkulirang, KAB. KUTAI TIMUR, KALIMANTAN TIMUR
53.15.04;Kec. Sano Nggoang, KAB. MANGGARAI BARAT, NUSA TENGGARA TIMUR
73.05.08;Kec. Sanrobone, KAB. TAKALAR, SULAWESI SELATAN
53.02.25;Kec. Santian, KAB. TIMOR TENGAH SELATAN, NUSA TENGGARA TIMUR
81.01.12;Kec. Saparua, KAB. MALUKU TENGAH, MALUKU
81.01.26;Kec. Saparua Timur, KAB. MALUKU TENGAH, MALUKU
52.06.06;Kec. Sape, KAB. BIMA, NUSA TENGGARA BARAT
35.29.25;Kec. Sapeken, KAB. SUMENEP, JAWA TIMUR
34.03.15;Kec. Saptosari, KAB. GUNUNGKIDUL, DAERAH ISTIMEWA YOGYAKARTA
33.07.03;Kec. Sapuran, KAB. WONOSOBO, JAWA TENGAH
35.19.12;Kec. Saradan, KAB. MADIUN, JAWA TIMUR
33.17.05;Kec. Sarang, KAB. REMBANG, JAWA TENGAH
71.71.06;Kec. Sario, KOTA MANADO, SULAWESI UTARA
35.24.27;Kec. Sarirejo, KAB. LAMONGAN, JAWA TIMUR
32.06.30;Kec. Sariwangi, KAB. TASIKMALAYA, JAWA BARAT
76.01.11;Kec. Sarjo, KAB. PASANGKAYU, SULAWESI BARAT
91.10.01;Kec. Sarmi, KAB. SARMI, PAPUA
91.10.12;Kec. Sarmi Selatan, KAB. SARMI, PAPUA
91.10.13;Kec. Sarmi Timur, KAB. SARMI, PAPUA
15.03.03;Kec. Sarolangun, KAB. SAROLANGUN, JAMBI
35.29.06;Kec. Saronggi, KAB. SUMENEP, JAWA TIMUR
12.01.20;Kec. Sarudik, KAB. TAPANULI TENGAH, SUMATERA UTARA
76.01.04;Kec. Sarudu, KAB. PASANGKAYU, SULAWESI BARAT
13.12.11;Kec. Sasak Ranah Pesisir, KAB. PASAMAN BARAT, SUMATERA BARAT
53.21.07;Kec. Sasitamean, KAB. MALAKA, NUSA TENGGARA TIMUR
53.10.05;Kec. Satar Mese, KAB. MANGGARAI, NUSA TENGGARA TIMUR
53.10.13;Kec. Satar Mese Barat, KAB. MANGGARAI, NUSA TENGGARA TIMUR
53.10.18;Kec. Satar Mese Utara, KAB. MANGGARAI, NUSA TENGGARA TIMUR
63.10.04;Kec. Satui, KAB. TANAH BUMBU, KALIMANTAN SELATAN
92.09.05;Kec. Sausapor, KAB. TAMBRAUW, PAPUA BARAT
72.08.06;Kec. Sausu, KAB. PARIGI MOUTONG, SULAWESI TENGAH
74.09.07;Kec. Sawa, KAB. KONAWE UTARA, SULAWESI TENGGARA
93.04.03;Kec. Sawa Erma, KAB. ASMAT, PAPUA SELATAN
31.71.02;Kec. Sawah Besar, KOTA ADM. JAKARTA PUSAT, DKI JAKARTA
35.18.01;Kec. Sawahan, KAB. NGANJUK, JAWA TIMUR
35.19.14;Kec. Sawahan, KAB. MADIUN, JAWA TIMUR
35.78.06;Kec. Sawahan, KOTA SURABAYA, JAWA TIMUR
91.20.08;Kec. Sawai, KAB. MAMBERAMO RAYA, PAPUA
51.08.07;Kec. Sawan, KAB. BULELENG, BALI
11.01.07;Kec. Sawang, KAB. ACEH SELATAN, ACEH
11.08.15;Kec. Sawang, KAB. ACEH UTARA, ACEH
32.76.03;Kec. Sawangan, KOTA DEPOK, JAWA BARAT
33.08.07;Kec. Sawangan, KAB. MAGELANG, JAWA TENGAH
74.13.01;Kec. Sawerigadi, KAB. MUNA BARAT, SULAWESI TENGGARA
92.04.06;Kec. Sawiat, KAB. SORONG SELATAN, PAPUA BARAT
33.09.08;Kec. Sawit, KAB. BOYOLALI, JAWA TENGAH
12.05.20;Kec. Sawit Seberang, KAB. LANGKAT, SUMATERA UTARA
12.24.02;Kec. Sawo, KAB. NIAS UTARA, SUMATERA UTARA
35.02.05;Kec. Sawoo, KAB. PONOROGO, JAWA TIMUR
61.10.05;Kec. Sayan, KAB. MELAWI, KALIMANTAN BARAT
92.01.10;Kec. Sayosa, KAB. SORONG, PAPUA BARAT
92.01.55;Kec. Sayosa Timur, KAB. SORONG, PAPUA BARAT
33.21.04;Kec. Sayung, KAB. DEMAK, JAWA TENGAH
12.03.21;Kec. Sayur Matinggi, KAB. TAPANULI SELATAN, SUMATERA UTARA
62.11.08;Kec. Sebangau Kuala, KAB. PULANG PISAU, KALIMANTAN TENGAH
61.08.10;Kec. Sebangki, KAB. LANDAK, KALIMANTAN BARAT
65.03.01;Kec. Sebatik, KAB. NUNUKAN, KALIMANTAN UTARA
65.03.08;Kec. Sebatik Barat, KAB. NUNUKAN, KALIMANTAN UTARA
65.03.12;Kec. Sebatik Tengah, KAB. NUNUKAN, KALIMANTAN UTARA
65.03.10;Kec. Sebatik Timur, KAB. NUNUKAN, KALIMANTAN UTARA
65.03.11;Kec. Sebatik Utara, KAB. NUNUKAN, KALIMANTAN UTARA
61.01.15;Kec. Sebawi, KAB. SAMBAS, KALIMANTAN BARAT
15.06.10;Kec. Seberang Kota, KAB. TANJUNG JABUNG BARAT, JAMBI
17.08.07;Kec. Seberang Musi, KAB. KEPAHIANG, BENGKULU
16.71.02;Kec. Seberang Ulu I, KOTA PALEMBANG, SUMATERA SELATAN
16.71.03;Kec. Seberang Ulu II, KOTA PALEMBANG, SUMATERA SELATAN
61.06.11;Kec. Seberuang, KAB. KAPUAS HULU, KALIMANTAN BARAT
65.03.06;Kec. Sebuku, KAB. NUNUKAN, KALIMANTAN UTARA
64.02.07;Kec. Sebulu, KAB. KUTAI KARTANEGARA, KALIMANTAN TIMUR
33.08.20;Kec. Secang, KAB. MAGELANG, JAWA TENGAH
12.05.09;Kec. Secanggang, KAB. LANGKAT, SUMATERA UTARA
33.17.06;Kec. Sedan, KAB. REMBANG, JAWA TENGAH
35.15.17;Kec. Sedati, KAB. SIDOARJO, JAWA TIMUR
34.02.17;Kec. Sedayu, KAB. BANTUL, DAERAH ISTIMEWA YOGYAKARTA
32.09.09;Kec. Sedong, KAB. CIREBON, JAWA BARAT
64.03.04;Kec. Segah, KAB. BERAU, KALIMANTAN TIMUR
61.02.15;Kec. Segedong, KAB. MEMPAWAH, KALIMANTAN BARAT
73.10.09;Kec. Segeri, KAB. PANGKAJENE KEPULAUAN, SULAWESI SELATAN
92.01.06;Kec. Seget, KAB. SORONG, PAPUA BARAT
17.01.02;Kec. Seginim, KAB. BENGKULU SELATAN, BENGKULU
92.01.12;Kec. Segun, KAB. SORONG, PAPUA BARAT
12.19.07;Kec. Sei Balai, KAB. BATU BARA, SUMATERA UTARA
12.18.15;Kec. Sei Bamban, KAB. SERDANG BEDAGAI, SUMATERA UTARA
21.71.07;Kec. Sei Beduk, KOTA BATAM, KEPULAUAN RIAU
12.05.04;Kec. Sei Bingai, KAB. LANGKAT, SUMATERA UTARA
12.09.23;Kec. Sei Dadap, KAB. ASAHAN, SUMATERA UTARA
12.09.11;Kec. Sei Kepayang, KAB. ASAHAN, SUMATERA UTARA
12.09.24;Kec. Sei Kepayang Barat, KAB. ASAHAN, SUMATERA UTARA
12.09.25;Kec. Sei Kepayang Timur, KAB. ASAHAN, SUMATERA UTARA
12.05.17;Kec. Sei Lepan, KAB. LANGKAT, SUMATERA UTARA
65.03.13;Kec. Sei Menggaris, KAB. NUNUKAN, KALIMANTAN UTARA
12.18.04;Kec. Sei Rampah, KAB. SERDANG BEDAGAI, SUMATERA UTARA
12.19.02;Kec. Sei Suka, KAB. BATU BARA, SUMATERA UTARA
12.74.03;Kec. Sei Tualang Raso, KOTA TANJUNG BALAI, SUMATERA UTARA
61.01.06;Kec. Sejangkung, KAB. SAMBAS, KALIMANTAN BARAT
61.09.01;Kec. Sekadau Hilir, KAB. SEKADAU, KALIMANTAN BARAT
61.09.02;Kec. Sekadau Hulu, KAB. SEKADAU, KALIMANTAN BARAT
18.07.05;Kec. Sekampung, KAB. LAMPUNG TIMUR, LAMPUNG
18.07.12;Kec. Sekampung Udik, KAB. LAMPUNG TIMUR, LAMPUNG
35.22.27;Kec. Sekar, KAB. BOJONEGORO, JAWA TIMUR
35.24.09;Kec. Sekaran, KAB. LAMONGAN, JAWA TIMUR
52.71.04;Kec. Sekarbela, KOTA MATARAM, NUSA TENGGARA BARAT
65.01.09;Kec. Sekatak, KAB. BULUNGAN, KALIMANTAN UTARA
61.03.07;Kec. Sekayam, KAB. SANGGAU, KALIMANTAN BARAT
16.06.01;Kec. Sekayu, KAB. MUSI BANYUASIN, SUMATERA SELATAN
11.16.12;Kec. Sekerak, KAB. ACEH TAMIANG, ACEH
15.05.02;Kec. Sekernan, KAB. MUARO JAMBI, JAMBI
18.04.08;Kec. Sekincau, KAB. LAMPUNG BARAT, LAMPUNG
73.22.07;Kec. Seko, KAB. LUWU UTARA, SULAWESI SELATAN
64.07.20;Kec. Sekolaq Darat, KAB. KUTAI BARAT, KALIMANTAN TIMUR
52.07.04;Kec. Sekongkang, KAB. SUMBAWA BARAT, NUSA TENGGARA BARAT
52.01.07;Kec. Sekotong, KAB. LOMBOK BARAT, NUSA TENGGARA BARAT
21.71.03;Kec. Sekupang, KOTA BATAM, KEPULAUAN RIAU
95.03.37;Kec. Sela, KAB. YAHUKIMO, PAPUA PEGUNUNGAN
32.05.39;Kec. Selaawi, KAB. GARUT, JAWA BARAT
18.02.20;Kec. Selagai Lingga, KAB. LAMPUNG TENGAH, LAMPUNG
17.06.09;Kec. Selagan Raya, KAB. MUKO MUKO, BENGKULU
32.08.15;Kec. Selajambe, KAB. KUNINGAN, JAWA BARAT
61.01.07;Kec. Selakau, KAB. SAMBAS, KALIMANTAN BARAT
61.01.19;Kec. Selakau Timur, KAB. SAMBAS, KALIMANTAN BARAT
16.05.11;Kec. Selangit, KAB. MUSI RAWAS, SUMATERA SELATAN
52.71.05;Kec. Selaprang, KOTA MATARAM, NUSA TENGGARA BARAT
81.03.02;Kec. Selaru, KAB. KEPULAUAN TANIMBAR, MALUKU
51.07.07;Kec. Selat, KAB. KARANGASEM, BALI
62.03.01;Kec. Selat, KAB. KAPUAS, KALIMANTAN TENGAH
21.02.13;Kec. Selat Gelam, KAB. KARIMUN, KEPULAUAN RIAU
19.02.03;Kec. Selat Nasik, KAB. BELITUNG, KEPULAUAN BANGKA BELITUNG
16.07.21;Kec. Selat Panuguan, KAB. BANYUASIN, SUMATERA SELATAN
21.04.08;Kec. Selayar, KAB. LINGGA, KEPULAUAN RIAU
17.71.01;Kec. Selebar, KOTA BENGKULU, BENGKULU
51.02.01;Kec. Selemadeg, KAB. TABANAN, BALI
51.02.03;Kec. Selemadeg Barat, KAB. TABANAN, BALI
51.02.02;Kec. Selemadeg Timur, KAB. TABANAN, BALI
92.09.29;Kec. Selemkai, KAB. TAMBRAUW, PAPUA BARAT
12.05.06;Kec. Selesai, KAB. LANGKAT, SUMATERA UTARA
61.06.09;Kec. Selimbau, KAB. KAPUAS HULU, KALIMANTAN BARAT
33.09.01;Kec. Selo, KAB. BOYOLALI, JAWA TENGAH
33.12.11;Kec. Selogiri, KAB. WONOGIRI, JAWA TENGAH
33.07.06;Kec. Selomerto, KAB. WONOSOBO, JAWA TENGAH
52.03.07;Kec. Selong, KAB. LOMBOK TIMUR, NUSA TENGGARA BARAT
33.23.15;Kec. Selopampang, KAB. TEMANGGUNG, JAWA TENGAH
35.05.22;Kec. Selopuro, KAB. BLITAR, JAWA TIMUR
35.05.21;Kec. Selorejo, KAB. BLITAR, JAWA TIMUR
61.07.05;Kec. Seluas, KAB. BENGKAYANG, KALIMANTAN BARAT
17.05.02;Kec. Seluma, KAB. SELUMA, BENGKULU
17.05.08;Kec. Seluma Barat, KAB. SELUMA, BENGKULU
17.05.11;Kec. Seluma Selatan, KAB. SELUMA, BENGKULU
17.05.09;Kec. Seluma Timur, KAB. SELUMA, BENGKULU
17.05.10;Kec. Seluma Utara, KAB. SELUMA, BENGKULU
17.02.11;Kec. Selupu Rejang, KAB. REJANG LEBONG, BENGKULU
11.02.10;Kec. Semadam, KAB. ACEH TENGGARA, ACEH
18.06.12;Kec. Semaka, KAB. TANGGAMUS, LAMPUNG
35.78.16;Kec. Semampir, KOTA SURABAYA, JAWA TIMUR
35.23.15;Kec. Semanding, KAB. TUBAN, JAWA TIMUR
93.01.05;Kec. Semangga, KAB. MERAUKE, PAPUA SELATAN
34.03.08;Kec. Semanu, KAB. GUNUNGKIDUL, DAERAH ISTIMEWA YOGYAKARTA
33.74.13;Kec. Semarang Barat, KOTA SEMARANG, JAWA TENGAH
33.74.07;Kec. Semarang Selatan, KOTA SEMARANG, JAWA TENGAH
33.74.01;Kec. Semarang Tengah, KOTA SEMARANG, JAWA TENGAH
33.74.03;Kec. Semarang Timur, KOTA SEMARANG, JAWA TENGAH
33.74.02;Kec. Semarang Utara, KOTA SEMARANG, JAWA TENGAH
16.71.16;Kec. Sematang Borang, KOTA PALEMBANG, SUMATERA SELATAN
62.09.06;Kec. Sematu Jaya, KAB. LAMANDAU, KALIMANTAN TENGAH
53.01.04;Kec. Semau, KAB. KUPANG, NUSA TENGGARA TIMUR
53.01.23;Kec. Semau Selatan, KAB. KUPANG, NUSA TENGGARA TIMUR
65.03.03;Kec. Sembakung, KAB. NUNUKAN, KALIMANTAN UTARA
65.03.16;Kec. Sembakung Atulai, KAB. NUNUKAN, KALIMANTAN UTARA
52.03.15;Kec. Sembalun, KAB. LOMBOK TIMUR, NUSA TENGGARA BARAT
16.07.17;Kec. Sembawa, KAB. BANYUASIN, SUMATERA SELATAN
13.10.05;Kec. Sembilan Koto, KAB. DHARMASRAYA, SUMATERA BARAT
64.02.20;Kec. Semboja Barat, KAB. KUTAI KARTANEGARA, KALIMANTAN TIMUR
35.09.07;Kec. Semboro, KAB. JEMBER, JAWA TIMUR
35.06.01;Kec. Semen, KAB. KEDIRI, JAWA TIMUR
16.08.14;Kec. Semendawai Barat, KAB. OGAN KOMERING ULU TIMUR, SUMATERA SELATAN
16.08.08;Kec. Semendawai Suku III, KAB. OGAN KOMERING ULU TIMUR, SUMATERA SELATAN
16.08.15;Kec. Semendawai Timur, KAB. OGAN KOMERING ULU TIMUR, SUMATERA SELATAN
16.03.08;Kec. Semende Darat Laut, KAB. MUARA ENIM, SUMATERA SELATAN
16.03.09;Kec. Semende Darat Tengah, KAB. MUARA ENIM, SUMATERA SELATAN
16.03.10;Kec. Semende Darat Ulu, KAB. MUARA ENIM, SUMATERA SELATAN
16.01.21;Kec. Semidang Aji, KAB. OGAN KOMERING ULU, SUMATERA SELATAN
17.05.04;Kec. Semidang Alas, KAB. SELUMA, BENGKULU
17.05.05;Kec. Semidang Alas Maras, KAB. SELUMA, BENGKULU
17.04.08;Kec. Semidang Gumay, KAB. KAUR, BENGKULU
17.09.11;Kec. Semidang Lagan, KAB. BENGKULU TENGAH, BENGKULU
34.03.12;Kec. Semin, KAB. GUNUNGKIDUL, DAERAH ISTIMEWA YOGYAKARTA
61.06.10;Kec. Semitau, KAB. KAPUAS HULU, KALIMANTAN BARAT
61.01.13;Kec. Semparuk, KAB. SAMBAS, KALIMANTAN BARAT
35.11.19;Kec. Sempol, KAB. BONDOWOSO, JAWA TIMUR
33.05.18;Kec. Sempor, KAB. KEBUMEN, JAWA TENGAH
35.10.20;Kec. Sempu, KAB. BANYUWANGI, JAWA TIMUR
14.71.05;Kec. Senapelan, KOTA PEKANBARU, RIAU
21.04.03;Kec. Senayang, KAB. LINGGA, KEPULAUAN RIAU
73.73.07;Kec. Sendana, KOTA PALOPO, SULAWESI SELATAN
76.05.03;Kec. Sendana, KAB. MAJENE, SULAWESI BARAT
35.04.07;Kec. Sendang, KAB. TULUNGAGUNG, JAWA TIMUR
18.02.22;Kec. Sendang Agung, KAB. LAMPUNG TENGAH, LAMPUNG
35.08.12;Kec. Senduro, KAB. LUMAJANG, JAWA TIMUR
31.71.04;Kec. Senen, KOTA ADM. JAKARTA PUSAT, DKI JAKARTA
61.08.07;Kec. Sengah Temila, KAB. LANDAK, KALIMANTAN BARAT
91.11.03;Kec. Senggi, KAB. KEEROM, PAPUA
92.09.11;Kec. Senopi, KAB. TAMBRAUW, PAPUA BARAT
35.23.05;Kec. Senori, KAB. TUBAN, JAWA TIMUR
14.09.14;Kec. Sentajo Raya, KAB. KUANTAN SINGINGI, RIAU
91.03.01;Kec. Sentani, KAB. JAYAPURA, PAPUA
91.03.04;Kec. Sentani Barat, KAB. JAYAPURA, PAPUA
91.03.02;Kec. Sentani Timur, KAB. JAYAPURA, PAPUA
34.01.06;Kec. Sentolo, KAB. KULON PROGO, DAERAH ISTIMEWA YOGYAKARTA
15.06.13;Kec. Senyerang, KAB. TANJUNG JABUNG BARAT, JAMBI
64.09.04;Kec. Sepaku, KAB. PENAJAM PASER UTARA, KALIMANTAN TIMUR
62.10.01;Kec. Sepang, KAB. GUNUNG MAS, KALIMANTAN TENGAH
36.03.16;Kec. Sepatan, KAB. TANGERANG, BANTEN
36.03.30;Kec. Sepatan Timur, KAB. TANGERANG, BANTEN
61.05.03;Kec. Sepauk, KAB. SINTANG, KALIMANTAN BARAT
61.11.05;Kec. Seponti, KAB. KAYONG UTARA, KALIMANTAN BARAT
35.26.08;Kec. Sepulu, KAB. BANGKALAN, JAWA TIMUR
18.02.16;Kec. Seputih Agung, KAB. LAMPUNG TENGAH, LAMPUNG
18.02.10;Kec. Seputih Banyak, KAB. LAMPUNG TENGAH, LAMPUNG
18.02.11;Kec. Seputih Mataram, KAB. LAMPUNG TENGAH, LAMPUNG
18.02.08;Kec. Seputih Raman, KAB. LAMPUNG TENGAH, LAMPUNG
18.02.12;Kec. Seputih Surabaya, KAB. LAMPUNG TENGAH, LAMPUNG
95.03.42;Kec. Seradala, KAB. YAHUKIMO, PAPUA PEGUNUNGAN
15.09.10;Kec. Serai Serumpun, KAB. TEBO, JAMBI
81.06.02;Kec. Seram Barat, KAB. SERAM BAGIAN BARAT, MALUKU
81.05.02;Kec. Seram Timur, KAB. SERAM BAGIAN TIMUR, MALUKU
81.01.06;Kec. Seram Utara, KAB. MALUKU TENGAH, MALUKU
81.01.20;Kec. Seram Utara Barat, KAB. MALUKU TENGAH, MALUKU
81.01.25;Kec. Seram Utara Timur Kobi, KAB. MALUKU TENGAH, MALUKU
81.01.24;Kec. Seram Utara Timur Seti, KAB. MALUKU TENGAH, MALUKU
95.02.15;Kec. Serambakon, KAB. PEGUNUNGAN BINTANG, PAPUA PEGUNUNGAN
62.02.12;Kec. Seranau, KAB. KOTAWARINGIN TIMUR, KALIMANTAN TENGAH
36.73.01;Kec. Serang, KOTA SERANG, BANTEN
32.16.21;Kec. Serang Baru, KAB. BEKASI, JAWA BARAT
32.13.23;Kec. Serangpanjang, KAB. SUBANG, JAWA BARAT
21.03.06;Kec. Serasan, KAB. NATUNA, KEPULAUAN RIAU
21.03.19;Kec. Serasan Timur, KAB. NATUNA, KEPULAUAN RIAU
61.05.14;Kec. Serawai, KAB. SINTANG, KALIMANTAN BARAT
12.18.12;Kec. Serba Jadi, KAB. SERDANG BEDAGAI, SUMATERA UTARA
11.03.05;Kec. Serbajadi, KAB. ACEH TIMUR, ACEH
92.04.11;Kec. Seremuk, KAB. SORONG SELATAN, PAPUA BARAT
33.72.02;Kec. Serengan, KOTA SURAKARTA, JAWA TENGAH
21.01.15;Kec. Seri Kuala Lobam, KAB. BINTAN, KEPULAUAN RIAU
62.12.09;Kec. Seribu Riam, KAB. MURUNG RAYA, KALIMANTAN TENGAH
51.08.02;Kec. Seririt, KAB. BULELENG, BALI
36.74.01;Kec. Serpong, KOTA TANGERANG SELATAN, BANTEN
36.74.02;Kec. Serpong Utara, KOTA TANGERANG SELATAN, BANTEN
11.16.04;Kec. Seruway, KAB. ACEH TAMIANG, ACEH
62.07.01;Kec. Seruyan Hilir, KAB. SERUYAN, KALIMANTAN TENGAH
62.07.06;Kec. Seruyan Hilir Timur, KAB. SERUYAN, KALIMANTAN TENGAH
62.07.05;Kec. Seruyan Hulu, KAB. SERUYAN, KALIMANTAN TENGAH
62.07.07;Kec. Seruyan Raya, KAB. SERUYAN, KALIMANTAN TENGAH
62.07.02;Kec. Seruyan Tengah, KAB. SERUYAN, KALIMANTAN TENGAH
65.04.01;Kec. Sesayap, KAB. TANA TIDUNG, KALIMANTAN UTARA
65.04.02;Kec. Sesayap Hilir, KAB. TANA TIDUNG, KALIMANTAN UTARA
73.26.02;Kec. Sesean, KAB. TORAJA UTARA, SULAWESI SELATAN
73.26.19;Kec. Sesean Suloara, KAB. TORAJA UTARA, SULAWESI SELATAN
76.03.08;Kec. Sesenapadang, KAB. MAMASA, SULAWESI BARAT
