33.08.10;Kec. Mertoyudan, KAB. MAGELANG, JAWA TENGAH
11.17.09;Kec. Mesidah, KAB. BENER MERIAH, ACEH
11.06.09;Kec. Mesjid Raya, KAB. ACEH BESAR, ACEH
76.03.07;Kec. Messawa, KAB. MAMASA, SULAWESI BARAT
15.05.05;Kec. Mestong, KAB. MUARO JAMBI, JAMBI
16.02.04;Kec. Mesuji, KAB. OGAN KOMERING ILIR, SUMATERA SELATAN
18.11.01;Kec. Mesuji, KAB. MESUJI, LAMPUNG
16.02.20;Kec. Mesuji Makmur, KAB. OGAN KOMERING ILIR, SUMATERA SELATAN
16.02.21;Kec. Mesuji Raya, KAB. OGAN KOMERING ILIR, SUMATERA SELATAN
18.11.02;Kec. Mesuji Timur, KAB. MESUJI, LAMPUNG
18.72.03;Kec. Metro Barat, KOTA METRO, LAMPUNG
18.07.10;Kec. Metro Kibang, KAB. LAMPUNG TIMUR, LAMPUNG
18.72.01;Kec. Metro Pusat, KOTA METRO, LAMPUNG
18.72.05;Kec. Metro Selatan, KOTA METRO, LAMPUNG
18.72.04;Kec. Metro Timur, KOTA METRO, LAMPUNG
18.72.02;Kec. Metro Utara, KOTA METRO, LAMPUNG
11.01.05;Kec. Meukek, KAB. ACEH SELATAN, ACEH
11.18.05;Kec. Meurah Dua, KAB. PIDIE JAYA, ACEH
11.08.07;Kec. Meurah Mulia, KAB. ACEH UTARA, ACEH
11.71.03;Kec. Meuraxa, KOTA BANDA ACEH, ACEH
11.05.09;Kec. Meureubo, KAB. ACEH BARAT, ACEH
11.18.01;Kec. Meureudu, KAB. PIDIE JAYA, ACEH
94.02.04;Kec. Mewoluk, KAB. PUNCAK JAYA, PAPUA TENGAH
92.06.23;Kec. Meyado, KAB. TELUK BINTUNI, PAPUA BARAT
71.04.13;Kec. Miangas, KAB. KEPULAUAN TALAUD, SULAWESI UTARA
21.03.04;Kec. Midai, KAB. NATUNA, KEPULAUAN RIAU
62.10.07;Kec. Mihing Raya, KAB. GUNUNG MAS, KALIMANTAN TENGAH
33.21.10;Kec. Mijen, KAB. DEMAK, JAWA TENGAH
33.74.14;Kec. Mijen, KOTA SEMARANG, JAWA TENGAH
11.07.11;Kec. Mila, KAB. PIDIE, ACEH
95.07.18;Kec. Milimbo, KAB. LANNY JAYA, PAPUA PEGUNUNGAN
94.04.04;Kec. Mimika Barat, KAB. MIMIKA, PAPUA TENGAH
94.04.11;Kec. Mimika Barat Jauh, KAB. MIMIKA, PAPUA TENGAH
94.04.12;Kec. Mimika Barat Tengah, KAB. MIMIKA, PAPUA TENGAH
94.04.01;Kec. Mimika Baru, KAB. MIMIKA, PAPUA TENGAH
94.04.08;Kec. Mimika Tengah, KAB. MIMIKA, PAPUA TENGAH
94.04.03;Kec. Mimika Timur, KAB. MIMIKA, PAPUA TENGAH
94.04.07;Kec. Mimika Timur Jauh, KAB. MIMIKA, PAPUA TENGAH
14.08.03;Kec. Minas, KAB. SIAK, RIAU
73.10.10;Kec. Minasa Tene, KAB. PANGKAJENE KEPULAUAN, SULAWESI SELATAN
93.02.02;Kec. Mindiptana, KAB. BOVEN DIGOEL, PAPUA SELATAN
34.04.04;Kec. Minggir, KAB. SLEMAN, DAERAH ISTIMEWA YOGYAKARTA
92.12.09;Kec. Minyambaouw, KAB. PEGUNUNGAN ARFAK, PAPUA BARAT
93.03.09;Kec. Minyamur, KAB. MAPPI, PAPUA SELATAN
53.03.02;Kec. Miomaffo Barat, KAB. TIMOR TENGAH UTARA, NUSA TENGGARA TIMUR
53.03.11;Kec. Miomaffo Tengah, KAB. TIMOR TENGAH UTARA, NUSA TENGGARA TIMUR
53.03.01;Kec. Miomaffo Timur, KAB. TIMOR TENGAH UTARA, NUSA TENGGARA TIMUR
33.14.14;Kec. Miri, KAB. SRAGEN, JAWA TENGAH
62.10.09;Kec. Miri Manasa, KAB. GUNUNG MAS, KALIMANTAN TENGAH
33.05.08;Kec. Mirit, KAB. KEBUMEN, JAWA TENGAH
92.05.01;Kec. Misool (Misool Utara), KAB. RAJA AMPAT, PAPUA BARAT
92.05.16;Kec. Misool Barat, KAB. RAJA AMPAT, PAPUA BARAT
92.05.13;Kec. Misool Selatan, KAB. RAJA AMPAT, PAPUA BARAT
92.05.06;Kec. Misool Timur, KAB. RAJA AMPAT, PAPUA BARAT
92.09.02;Kec. Miyah, KAB. TAMBRAUW, PAPUA BARAT
92.09.16;Kec. Miyah Selatan, KAB. TAMBRAUW, PAPUA BARAT
35.12.04;Kec. Mlandingan, KAB. SITUBONDO, JAWA TIMUR
35.02.08;Kec. Mlarak, KAB. PONOROGO, JAWA TIMUR
34.04.06;Kec. Mlati, KAB. SLEMAN, DAERAH ISTIMEWA YOGYAKARTA
33.20.07;Kec. Mlonggo, KAB. JEPARA, JAWA TENGAH
81.08.03;Kec. Mndona Hiera, KAB. MALUKU BARAT DAYA, MALUKU
81.08.01;Kec. Moa Lakor, KAB. MALUKU BARAT DAYA, MALUKU
95.08.28;Kec. Moba, KAB. NDUGA, PAPUA PEGUNUNGAN
71.10.04;Kec. Modayag, KAB. BOLAANG MONGONDOW TIMUR, SULAWESI UTARA
71.10.05;Kec. Modayag Barat, KAB. BOLAANG MONGONDOW TIMUR, SULAWESI UTARA
35.24.03;Kec. Modo, KAB. LAMONGAN, JAWA TIMUR
71.05.01;Kec. Modoinding, KAB. MINAHASA SELATAN, SULAWESI UTARA
35.26.16;Kec. Modung, KAB. BANGKALAN, JAWA TIMUR
95.02.29;Kec. Mofinop, KAB. PEGUNUNGAN BINTANG, PAPUA PEGUNUNGAN
33.27.01;Kec. Moga, KAB. PEMALANG, JAWA TENGAH
72.01.14;Kec. Moilong, KAB. BANGGAI, SULAWESI TENGAH
92.01.42;Kec. Moisegen, KAB. SORONG, PAPUA BARAT
35.06.02;Kec. Mojo, KAB. KEDIRI, JAWA TIMUR
35.17.06;Kec. Mojoagung, KAB. JOMBANG, JAWA TIMUR
35.16.18;Kec. Mojoanyar, KAB. MOJOKERTO, JAWA TIMUR
33.13.15;Kec. Mojogedang, KAB. KARANGANYAR, JAWA TENGAH
33.11.08;Kec. Mojolaban, KAB. SUKOHARJO, JAWA TENGAH
35.71.01;Kec. Mojoroto, KOTA KEDIRI, JAWA TIMUR
35.16.08;Kec. Mojosari, KAB. MOJOKERTO, JAWA TIMUR
33.09.06;Kec. Mojosongo, KAB. BOYOLALI, JAWA TENGAH
33.07.11;Kec. Mojotengah, KAB. WONOSOBO, JAWA TENGAH
35.17.07;Kec. Mojowarno, KAB. JOMBANG, JAWA TIMUR
95.07.16;Kec. Mokoni, KAB. LANNY JAYA, PAPUA PEGUNUNGAN
95.01.28;Kec. Molagalome, KAB. JAYAWIJAYA, PAPUA PEGUNUNGAN
94.02.16;Kec. Molanikime, KAB. PUNCAK JAYA, PAPUA TENGAH
74.09.04;Kec. Molawe, KAB. KONAWE UTARA, SULAWESI TENGGARA
53.02.22;Kec. Mollo Barat, KAB. TIMOR TENGAH SELATAN, NUSA TENGGARA TIMUR
53.02.02;Kec. Mollo Selatan, KAB. TIMOR TENGAH SELATAN, NUSA TENGGARA TIMUR
53.02.30;Kec. Mollo Tengah, KAB. TIMOR TENGAH SELATAN, NUSA TENGGARA TIMUR
53.02.03;Kec. Mollo Utara, KAB. TIMOR TENGAH SELATAN, NUSA TENGGARA TIMUR
81.03.18;Kec. Molu Maru, KAB. KEPULAUAN TANIMBAR, MALUKU
92.11.05;Kec. Momi Waren, KAB. MANOKWARI SELATAN, PAPUA BARAT
72.05.01;Kec. Momunu, KAB. BUOL, SULAWESI TENGAH
75.05.09;Kec. Monano, KAB. GORONTALO UTARA, GORONTALO
73.09.13;Kec. Moncongloe, KAB. MAROS, SULAWESI SELATAN
33.14.16;Kec. Mondokan, KAB. SRAGEN, JAWA TENGAH
52.06.01;Kec. Monta, KAB. BIMA, NUSA TENGGARA BARAT
62.05.01;Kec. Montallat, KAB. BARITO UTARA, KALIMANTAN TENGAH
11.06.05;Kec. Montasik, KAB. ACEH BESAR, ACEH
61.07.08;Kec. Monterado, KAB. BENGKAYANG, KALIMANTAN BARAT
35.23.10;Kec. Montong, KAB. TUBAN, JAWA TIMUR
52.03.11;Kec. Montong Gading, KAB. LOMBOK TIMUR, NUSA TENGGARA BARAT
71.10.07;Kec. Mooat, KAB. BOLAANG MONGONDOW TIMUR, SULAWESI UTARA
64.07.18;Kec. Mook Manaar Bulatn, KAB. KUTAI BARAT, KALIMANTAN TIMUR
94.01.13;Kec. Moora, KAB. NABIRE, PAPUA TENGAH
75.01.14;Kec. Mootilango, KAB. GORONTALO, GORONTALO
92.09.08;Kec. Moraid, KAB. TAMBRAUW, PAPUA BARAT
74.05.10;Kec. Moramo, KAB. KONAWE SELATAN, SULAWESI TENGGARA
74.05.16;Kec. Moramo Utara, KAB. KONAWE SELATAN, SULAWESI TENGGARA
72.12.05;Kec. Mori Atas, KAB. MOROWALI UTARA, SULAWESI TENGAH
72.12.06;Kec. Mori Utara, KAB. MOROWALI UTARA, SULAWESI TENGAH
21.02.01;Kec. Moro, KAB. KARIMUN, KEPULAUAN RIAU
12.25.04;Kec. Moro'o, KAB. NIAS BARAT, SUMATERA UTARA
71.04.17;Kec. Moronge, KAB. KEPULAUAN TALAUD, SULAWESI UTARA
74.02.39;Kec. Morosi, KAB. KONAWE, SULAWESI TENGGARA
82.07.03;Kec. Morotai Jaya, KAB. PULAU MOROTAI, MALUKU UTARA
82.07.01;Kec. Morotai Selatan, KAB. PULAU MOROTAI, MALUKU UTARA
82.07.02;Kec. Morotai Selatan Barat, KAB. PULAU MOROTAI, MALUKU UTARA
82.07.05;Kec. Morotai Timur, KAB. PULAU MOROTAI, MALUKU UTARA
82.07.04;Kec. Morotai Utara, KAB. PULAU MOROTAI, MALUKU UTARA
92.06.22;Kec. Moskona Barat, KAB. TELUK BINTUNI, PAPUA BARAT
92.06.05;Kec. Moskona Selatan, KAB. TELUK BINTUNI, PAPUA BARAT
92.06.24;Kec. Moskona Timur, KAB. TELUK BINTUNI, PAPUA BARAT
92.06.06;Kec. Moskona Utara, KAB. TELUK BINTUNI, PAPUA BARAT
92.04.10;Kec. Moswaren, KAB. SORONG SELATAN, PAPUA BARAT
82.71.04;Kec. Moti, KOTA TERNATE, MALUKU UTARA
71.05.07;Kec. Motoling, KAB. MINAHASA SELATAN, SULAWESI UTARA
71.05.21;Kec. Motoling Barat, KAB. MINAHASA SELATAN, SULAWESI UTARA
71.05.22;Kec. Motoling Timur, KAB. MINAHASA SELATAN, SULAWESI UTARA
71.10.06;Kec. Motongkad, KAB. BOLAANG MONGONDOW TIMUR, SULAWESI UTARA
74.09.10;Kec. Motui, KAB. KONAWE UTARA, SULAWESI TENGGARA
72.08.04;Kec. Moutong, KAB. PARIGI MOUTONG, SULAWESI TENGAH
74.11.07;Kec. Mowewe, KAB. KOLAKA TIMUR, SULAWESI TENGGARA
74.05.15;Kec. Mowila, KAB. KONAWE SELATAN, SULAWESI TENGGARA
52.04.09;Kec. Moyo Hilir, KAB. SUMBAWA, NUSA TENGGARA BARAT
52.04.10;Kec. Moyo Hulu, KAB. SUMBAWA, NUSA TENGGARA BARAT
52.04.23;Kec. Moyo Utara, KAB. SUMBAWA, NUSA TENGGARA BARAT
34.04.03;Kec. Moyudan, KAB. SLEMAN, DAERAH ISTIMEWA YOGYAKARTA
52.72.05;Kec. Mpunda, KOTA BIMA, NUSA TENGGARA BARAT
92.09.26;Kec. Mpur, KAB. TAMBRAUW, PAPUA BARAT
33.21.01;Kec. Mranggen, KAB. DEMAK, JAWA TENGAH
33.03.08;Kec. Mrebet, KAB. PURBALINGGA, JAWA TENGAH
12.02.15;Kec. Muara, KAB. TAPANULI UTARA, SUMATERA UTARA
94.02.12;Kec. Muara, KAB. PUNCAK JAYA, PAPUA TENGAH
95.07.37;Kec. Muara, KAB. LANNY JAYA, PAPUA PEGUNUNGAN
64.08.01;Kec. Muara Ancalong, KAB. KUTAI TIMUR, KALIMANTAN TIMUR
64.02.05;Kec. Muara Badak, KAB. KUTAI KARTANEGARA, KALIMANTAN TIMUR
17.71.04;Kec. Muara Bangka Hulu, KOTA BENGKULU, BENGKULU
12.13.17;Kec. Muara Batang Gadis, KAB. MANDAILING NATAL, SUMATERA UTARA
12.03.29;Kec. Muara Batang Toru, KAB. TAPANULI SELATAN, SUMATERA UTARA
11.08.06;Kec. Muara Batu, KAB. ACEH UTARA, ACEH
16.03.22;Kec. Muara Belida, KAB. MUARA ENIM, SUMATERA SELATAN
16.05.09;Kec. Muara Beliti, KAB. MUSI RAWAS, SUMATERA SELATAN
64.08.03;Kec. Muara Bengkal, KAB. KUTAI TIMUR, KALIMANTAN TIMUR
15.04.03;Kec. Muara Bulian, KAB. BATANGHARI, JAMBI
11.73.01;Kec. Muara Dua, KOTA LHOKSEUMAWE, ACEH
16.09.01;Kec. Muara Dua, KAB. OGAN KOMERING ULU SELATAN, SUMATERA SELATAN
16.09.04;Kec. Muara Dua Kisam, KAB. OGAN KOMERING ULU SELATAN, SUMATERA SELATAN
16.03.02;Kec. Muara Enim, KAB. MUARA ENIM, SUMATERA SELATAN
63.09.08;Kec. Muara Harus, KAB. TABALONG, KALIMANTAN SELATAN
64.02.14;Kec. Muara Jawa, KAB. KUTAI KARTANEGARA, KALIMANTAN TIMUR
16.01.31;Kec. Muara Jaya, KAB. OGAN KOMERING ULU, SUMATERA SELATAN
64.02.11;Kec. Muara Kaman, KAB. KUTAI KARTANEGARA, KALIMANTAN TIMUR
16.05.03;Kec. Muara Kelingi, KAB. MUSI RAWAS, SUMATERA SELATAN
17.08.08;Kec. Muara Kemumu, KAB. KEPAHIANG, BENGKULU
64.01.07;Kec. Muara Komam, KAB. PASER, KALIMANTAN TIMUR
16.10.01;Kec. Muara Kuang, KAB. OGAN ILIR, SUMATERA SELATAN
16.05.02;Kec. Muara Lakitan, KAB. MUSI RAWAS, SUMATERA SELATAN
64.07.09;Kec. Muara Lawa, KAB. KUTAI BARAT, KALIMANTAN TIMUR
64.02.01;Kec. Muara Muntai, KAB. KUTAI KARTANEGARA, KALIMANTAN TIMUR
16.07.07;Kec. Muara Padang, KAB. BANYUASIN, SUMATERA SELATAN
64.07.10;Kec. Muara Pahu, KAB. KUTAI BARAT, KALIMANTAN TIMUR
15.06.09;Kec. Muara Papalik, KAB. TANJUNG JABUNG BARAT, JAMBI
61.04.17;Kec. Muara Pawan, KAB. KETAPANG, KALIMANTAN BARAT
16.11.01;Kec. Muara Pinang, KAB. EMPAT LAWANG, SUMATERA SELATAN
15.07.07;Kec. Muara Sabak Barat, KAB. TANJUNG JABUNG TIMUR, JAMBI
15.07.01;Kec. Muara Sabak Timur, KAB. TANJUNG JABUNG TIMUR, JAMBI
17.04.11;Kec. Muara Sahung, KAB. KAUR, BENGKULU
64.01.10;Kec. Muara Samu, KAB. PASER, KALIMANTAN TIMUR
11.73.04;Kec. Muara Satu, KOTA LHOKSEUMAWE, ACEH
15.02.03;Kec. Muara Siau, KAB. MERANGIN, JAMBI
12.13.12;Kec. Muara Sipongi, KAB. MANDAILING NATAL, SUMATERA UTARA
16.07.13;Kec. Muara Sugihan, KAB. BANYUASIN, SUMATERA SELATAN
18.03.15;Kec. Muara Sungkai, KAB. LAMPUNG UTARA, LAMPUNG
15.09.12;Kec. Muara Tabir, KAB. TEBO, JAMBI
91.71.04;Kec. Muara Tami, KOTA JAYAPURA, PAPUA
16.07.08;Kec. Muara Telang, KAB. BANYUASIN, SUMATERA SELATAN
15.04.02;Kec. Muara Tembesi, KAB. BATANGHARI, JAMBI
11.07.12;Kec. Muara Tiga, KAB. PIDIE, ACEH
63.09.07;Kec. Muara Uya, KAB. TABALONG, KALIMANTAN SELATAN
64.08.02;Kec. Muara Wahau, KAB. KUTAI TIMUR, KALIMANTAN TIMUR
64.02.18;Kec. Muara Wis, KAB. KUTAI KARTANEGARA, KALIMANTAN TIMUR
32.16.17;Kec. Muaragembong, KAB. BEKASI, JAWA BARAT
16.04.28;Kec. Muarapayang, KAB. LAHAT, SUMATERA SELATAN
92.09.12;Kec. Mubrani, KAB. TAMBRAUW, PAPUA BARAT
95.03.15;Kec. Mugi, KAB. YAHUKIMO, PAPUA PEGUNUNGAN
95.08.06;Kec. Mugi, KAB. NDUGA, PAPUA PEGUNUNGAN
15.08.08;Kec. Muko-muko Bathin VII, KAB. BUNGO, JAMBI
61.03.02;Kec. Mukok, KAB. SANGGAU, KALIMANTAN BARAT
16.04.30;Kec. Mulak Sebingkai, KAB. LAHAT, SUMATERA SELATAN
16.04.15;Kec. Mulak Ulu, KAB. LAHAT, SUMATERA SELATAN
94.02.01;Kec. Mulia, KAB. PUNCAK JAYA, PAPUA TENGAH
95.01.32;Kec. Muliama, KAB. JAYAWIJAYA, PAPUA PEGUNUNGAN
35.78.26;Kec. Mulyorejo, KOTA SURABAYA, JAWA TIMUR
35.09.23;Kec. Mumbulsari, KAB. JEMBER, JAWA TIMUR
36.02.05;Kec. Muncang, KAB. LEBAK, BANTEN
35.10.05;Kec. Muncar, KAB. BANYUWANGI, JAWA TIMUR
32.09.12;Kec. Mundu, KAB. CIREBON, JAWA BARAT
13.07.11;Kec. Mungka, KAB. LIMA PULUH KOTA, SUMATERA BARAT
73.73.08;Kec. Mungkajang, KOTA PALOPO, SULAWESI SELATAN
33.08.09;Kec. Mungkid, KAB. MAGELANG, JAWA TENGAH
36.01.08;Kec. Munjul, KAB. PANDEGLANG, BANTEN
35.03.02;Kec. Munjungan, KAB. TRENGGALEK, JAWA TIMUR
12.06.06;Kec. Munte, KAB. KARO, SUMATERA UTARA
33.08.08;Kec. Muntilan, KAB. MAGELANG, JAWA TENGAH
74.72.06;Kec. Murhum, KOTA BAU BAU, SULAWESI TENGGARA
95.02.28;Kec. Murkim, KAB. PEGUNUNGAN BINTANG, PAPUA PEGUNUNGAN
65.04.05;Kec. Muruk Rian, KAB. TANA TIDUNG, KALIMANTAN UTARA
62.12.01;Kec. Murung, KAB. MURUNG RAYA, KALIMANTAN TENGAH
63.09.06;Kec. Murung Pudak, KAB. TABALONG, KALIMANTAN SELATAN
95.03.12;Kec. Musaik, KAB. YAHUKIMO, PAPUA PEGUNUNGAN
95.01.07;Kec. Musatfak, KAB. JAYAWIJAYA, PAPUA PEGUNUNGAN
53.03.12;Kec. Musi, KAB. TIMOR TENGAH UTARA, NUSA TENGGARA TIMUR
32.75.11;Kec. Mustikajaya, KOTA BEKASI, JAWA BARAT
33.09.04;Kec. Musuk, KAB. BOYOLALI, JAWA TENGAH
11.07.13;Kec. Mutiara, KAB. PIDIE, ACEH
11.07.24;Kec. Mutiara Timur, KAB. PIDIE, ACEH
93.01.02;Kec. Muting, KAB. MERAUKE, PAPUA SELATAN
53.03.13;Kec. Mutis, KAB. TIMOR TENGAH UTARA, NUSA TENGGARA TIMUR
94.03.14;Kec. Muye, KAB. PANIAI, PAPUA TENGAH
12.23.06;Kec. Na IX - X, KAB. LABUHANBATU UTARA, SUMATERA UTARA
94.01.01;Kec. Nabire, KAB. NABIRE, PAPUA TENGAH
94.01.12;Kec. Nabire Barat, KAB. NABIRE, PAPUA TENGAH
95.04.17;Kec. Nabunage, KAB. TOLIKARA, PAPUA PEGUNUNGAN
12.13.23;Kec. Naga Juang, KAB. MANDAILING NATAL, SUMATERA UTARA
53.13.01;Kec. Naga Wutung, KAB. LEMBATA, NUSA TENGGARA TIMUR
32.02.12;Kec. Nagrak, KAB. SUKABUMI, JAWA BARAT
32.04.26;Kec. Nagreg, KAB. BANDUNG, JAWA BARAT
53.03.18;Kec. Naibenu, KAB. TIMOR TENGAH UTARA, NUSA TENGGARA TIMUR
92.07.07;Kec. Naikere, KAB. TELUK WONDAMA, PAPUA BARAT
12.17.03;Kec. Nainggolan, KAB. SAMOSIR, SUMATERA UTARA
94.03.15;Kec. Nakama, KAB. PANIAI, PAPUA TENGAH
95.03.06;Kec. Nalca, KAB. YAHUKIMO, PAPUA PEGUNUNGAN
15.02.11;Kec. Nalo Tantan, KAB. MERANGIN, JAMBI
33.20.12;Kec. Nalumsari, KAB. JEPARA, JAWA TENGAH
12.06.16;Kec. Naman Teran, KAB. KARO, SUMATERA UTARA
19.04.05;Kec. Namang, KAB. BANGKA TENGAH, KEPULAUAN BANGKA BELITUNG
91.03.14;Kec. Nambluong, KAB. JAYAPURA, PAPUA
72.01.23;Kec. Nambo, KAB. BANGGAI, SULAWESI TENGAH
74.71.11;Kec. Nambo, KOTA KENDARI, SULAWESI TENGGARA
81.04.01;Kec. Namlea, KAB. BURU, MALUKU
12.07.06;Kec. Namo Rambe, KAB. DELI SERDANG, SUMATERA UTARA
12.24.05;Kec. Namohalu Esiwa, KAB. NIAS UTARA, SUMATERA UTARA
81.09.01;Kec. Namrole, KAB. BURU SELATAN, MALUKU
13.05.03;Kec. Nan Sabaris, KAB. PADANG PARIAMAN, SUMATERA BARAT
53.04.23;Kec. Nanaet Duabesi, KAB. BELU, NUSA TENGGARA TIMUR
61.09.04;Kec. Nanga Mahap, KAB. SEKADAU, KALIMANTAN BARAT
61.10.02;Kec. Nanga Pinoh, KAB. MELAWI, KALIMANTAN BARAT
61.09.03;Kec. Nanga Taman, KAB. SEKADAU, KALIMANTAN BARAT
61.04.11;Kec. Nanga Tayap, KAB. KETAPANG, KALIMANTAN BARAT
53.08.01;Kec. Nangapanda, KAB. ENDE, NUSA TENGGARA TIMUR
53.16.02;Kec. Nangaroro, KAB. NAGEKEO, NUSA TENGGARA TIMUR
73.26.03;Kec. Nanggala, KAB. TORAJA UTARA, SULAWESI SELATAN
13.71.10;Kec. Nanggalo, KOTA PADANG, SUMATERA BARAT
34.01.10;Kec. Nanggulan, KAB. KULON PROGO, DAERAH ISTIMEWA YOGYAKARTA
32.01.21;Kec. Nanggung, KAB. BOGOR, JAWA BARAT
71.04.05;Kec. Nanusa, KAB. KEPULAUAN TALAUD, SULAWESI UTARA
74.03.06;Kec. Napabalano, KAB. MUNA, SULAWESI TENGGARA
17.03.13;Kec. Napal Putih, KAB. BENGKULU UTARA, BENGKULU
94.01.02;Kec. Napan, KAB. NABIRE, PAPUA TENGAH
74.13.11;Kec. Napano Kusambi, KAB. MUNA BARAT, SULAWESI TENGGARA
95.01.13;Kec. Napua, KAB. JAYAWIJAYA, PAPUA PEGUNUNGAN
32.03.24;Kec. Naringgul, KAB. CIANJUR, JAWA BARAT
52.01.03;Kec. Narmada, KAB. LOMBOK BARAT, NUSA TENGGARA BARAT
17.04.07;Kec. Nasal, KAB. KAUR, BENGKULU
12.12.21;Kec. Nassau, KAB. TOBA, SUMATERA UTARA
12.13.16;Kec. Natal, KAB. MANDAILING NATAL, SUMATERA UTARA
18.01.04;Kec. Natar, KAB. LAMPUNG SELATAN, LAMPUNG
93.01.12;Kec. Naukenjerai, KAB. MERAUKE, PAPUA SELATAN
35.01.07;Kec. Nawangan, KAB. PACITAN, JAWA TIMUR
53.14.09;Kec. Ndao Nuse, KAB. ROTE NDAO, NUSA TENGGARA TIMUR
53.08.05;Kec. Ndona, KAB. ENDE, NUSA TENGGARA TIMUR
53.08.16;Kec. Ndona Timur, KAB. ENDE, NUSA TENGGARA TIMUR
53.08.17;Kec. Ndori, KAB. ENDE, NUSA TENGGARA TIMUR
53.15.08;Kec. Ndoso, KAB. MANGGARAI BARAT, NUSA TENGGARA TIMUR
51.01.01;Kec. Negara, KAB. JEMBRANA, BALI
18.08.11;Kec. Negara Batin, KAB. WAY KANAN, LAMPUNG
18.08.07;Kec. Negeri Agung, KAB. WAY KANAN, LAMPUNG
18.08.12;Kec. Negeri Besar, KAB. WAY KANAN, LAMPUNG
18.09.02;Kec. Negeri Katon, KAB. PESAWARAN, LAMPUNG
36.71.10;Kec. Neglasari, KOTA TANGERANG, BANTEN
53.01.16;Kec. Nekamese, KAB. KUPANG, NUSA TENGGARA TIMUR
95.04.13;Kec. Nelawi, KAB. TOLIKARA, PAPUA PEGUNUNGAN
53.07.07;Kec. Nelle, KAB. SIKKA, NUSA TENGGARA TIMUR
92.11.03;Kec. Neney, KAB. MANOKWARI SELATAN, PAPUA BARAT
95.08.30;Kec. Nenggeagin, KAB. NDUGA, PAPUA PEGUNUNGAN
61.08.01;Kec. Ngabang, KAB. LANDAK, KALIMANTAN BARAT
33.08.17;Kec. Ngablak, KAB. MAGELANG, JAWA TENGAH
35.06.04;Kec. Ngadiluwih, KAB. KEDIRI, JAWA TIMUR
33.23.09;Kec. Ngadirejo, KAB. TEMANGGUNG, JAWA TENGAH
33.12.13;Kec. Ngadirojo, KAB. WONOGIRI, JAWA TENGAH
35.01.11;Kec. Ngadirojo, KAB. PACITAN, JAWA TIMUR
53.11.21;Kec. Ngadu Ngala, KAB. SUMBA TIMUR, NUSA TENGGARA TIMUR
34.04.12;Kec. Ngaglik, KAB. SLEMAN, DAERAH ISTIMEWA YOGYAKARTA
35.07.20;Kec. Ngajum, KAB. MALANG, JAWA TIMUR
33.74.15;Kec. Ngaliyan, KOTA SEMARANG, JAWA TENGAH
35.22.03;Kec. Ngambon, KAB. BOJONEGORO, JAWA TIMUR
18.13.09;Kec. Ngambur, KAB. PESISIR BARAT, LAMPUNG
33.24.19;Kec. Ngampel, KAB. KENDAL, JAWA TENGAH
34.71.06;Kec. Ngampilan, KOTA YOGYAKARTA, DAERAH ISTIMEWA YOGYAKARTA
32.17.06;Kec. Ngamprah, KAB. BANDUNG BARAT, JAWA BARAT
35.06.07;Kec. Ngancar, KAB. KEDIRI, JAWA TIMUR
35.18.13;Kec. Nganjuk, KAB. NGANJUK, JAWA TIMUR
35.07.27;Kec. Ngantang, KAB. MALANG, JAWA TIMUR
35.04.04;Kec. Ngantru, KAB. TULUNGAGUNG, JAWA TIMUR
74.08.06;Kec. Ngapa, KAB. KOLAKA UTARA, SULAWESI TENGGARA
18.13.10;Kec. Ngaras, KAB. PESISIR BARAT, LAMPUNG
33.13.07;Kec. Ngargoyoso, KAB. KARANGANYAR, JAWA TENGAH
35.20.16;Kec. Ngariboyo, KAB. MAGETAN, JAWA TIMUR
33.15.09;Kec. Ngaringan, KAB. GROBOGAN, JAWA TENGAH
35.06.25;Kec. Ngasem, KAB. KEDIRI, JAWA TIMUR
35.22.04;Kec. Ngasem, KAB. BOJONEGORO, JAWA TIMUR
33.10.22;Kec. Ngawen, KAB. KLATEN, JAWA TENGAH
33.16.12;Kec. Ngawen, KAB. BLORA, JAWA TENGAH
34.03.13;Kec. Ngawen, KAB. GUNUNGKIDUL, DAERAH ISTIMEWA YOGYAKARTA
35.21.09;Kec. Ngawi, KAB. NGAWI, JAWA TIMUR
35.02.19;Kec. Ngebel, KAB. PONOROGO, JAWA TIMUR
33.09.11;Kec. Ngemplak, KAB. BOYOLALI, JAWA TENGAH
34.04.11;Kec. Ngemplak, KAB. SLEMAN, DAERAH ISTIMEWA YOGYAKARTA
35.18.02;Kec. Ngetos, KAB. NGANJUK, JAWA TIMUR
53.11.04;Kec. Nggaha Ori Angu, KAB. SUMBA TIMUR, NUSA TENGGARA TIMUR
93.01.16;Kec. Ngguti, KAB. MERAUKE, PAPUA SELATAN
35.24.04;Kec. Ngimbang, KAB. LAMONGAN, JAWA TIMUR
35.05.09;Kec. Nglegok, KAB. BLITAR, JAWA TIMUR
34.03.02;Kec. Nglipar, KAB. GUNUNGKIDUL, DAERAH ISTIMEWA YOGYAKARTA
33.08.03;Kec. Ngluwar, KAB. MAGELANG, JAWA TENGAH
35.18.18;Kec. Ngluyu, KAB. NGANJUK, JAWA TIMUR
33.06.02;Kec. Ngombol, KAB. PURWOREJO, JAWA TENGAH
35.16.05;Kec. Ngoro, KAB. MOJOKERTO, JAWA TIMUR
35.17.03;Kec. Ngoro, KAB. JOMBANG, JAWA TIMUR
35.22.01;Kec. Ngraho, KAB. BOJONEGORO, JAWA TIMUR
35.21.02;Kec. Ngrambe, KAB. NGAWI, JAWA TIMUR
33.14.08;Kec. Ngrampal, KAB. SRAGEN, JAWA TENGAH
35.02.02;Kec. Ngrayun, KAB. PONOROGO, JAWA TIMUR
35.18.07;Kec. Ngronggot, KAB. NGANJUK, JAWA TIMUR
35.14.21;Kec. Nguling, KAB. PASURUAN, JAWA TIMUR
33.12.06;Kec. Nguntoronadi, KAB. WONOGIRI, JAWA TENGAH
35.20.17;Kec. Nguntoronadi, KAB. MAGETAN, JAWA TIMUR
35.04.11;Kec. Ngunut, KAB. TULUNGAGUNG, JAWA TIMUR
35.17.21;Kec. Ngusikan, KAB. JOMBANG, JAWA TIMUR
33.11.05;Kec. Nguter, KAB. SUKOHARJO, JAWA TENGAH
11.08.21;Kec. Nibong, KAB. ACEH UTARA, ACEH
16.13.03;Kec. Nibung, KAB. MUSI RAWAS UTARA, SUMATERA SELATAN
12.19.12;Kec. Nibung Hangus, KAB. BATU BARA, SUMATERA UTARA
92.07.12;Kec. Nikiwar, KAB. TELUK WONDAMA, PAPUA BARAT
95.07.36;Kec. Nikogwe, KAB. LANNY JAYA, PAPUA PEGUNUNGAN
91.03.08;Kec. Nimbokrang, KAB. JAYAPURA, PAPUA
91.03.07;Kec. Nimboran, KAB. JAYAPURA, PAPUA
95.07.11;Kec. Niname, KAB. LANNY JAYA, PAPUA PEGUNUNGAN
93.02.17;Kec. Ninati, KAB. BOVEN DIGOEL, PAPUA SELATAN
95.03.03;Kec. Ninia, KAB. YAHUKIMO, PAPUA PEGUNUNGAN
94.02.22;Kec. Nioga, KAB. PUNCAK JAYA, PAPUA TENGAH
15.07.02;Kec. Nipah Panjang, KAB. TANJUNG JABUNG TIMUR, JAMBI
95.03.22;Kec. Nipsan, KAB. YAHUKIMO, PAPUA PEGUNUNGAN
95.08.19;Kec. Nirkuri, KAB. NDUGA, PAPUA PEGUNUNGAN
81.03.09;Kec. Nirunmas, KAB. KEPULAUAN TANIMBAR, MALUKU
11.08.16;Kec. Nisam, KAB. ACEH UTARA, ACEH
11.08.27;Kec. Nisam Antara, KAB. ACEH UTARA, ACEH
53.07.04;Kec. Nita, KAB. SIKKA, NUSA TENGGARA TIMUR
53.02.24;Kec. Noebana, KAB. TIMOR TENGAH SELATAN, NUSA TENGGARA TIMUR
53.02.26;Kec. Noebeba, KAB. TIMOR TENGAH SELATAN, NUSA TENGGARA TIMUR
53.03.04;Kec. Noemuti, KAB. TIMOR TENGAH UTARA, NUSA TENGGARA TIMUR
53.03.10;Kec. Noemuti Timur, KAB. TIMOR TENGAH UTARA, NUSA TENGGARA TIMUR
95.07.12;Kec. Nogi, KAB. LANNY JAYA, PAPUA PEGUNUNGAN
33.09.12;Kec. Nogosari, KAB. BOYOLALI, JAWA TENGAH
72.10.03;Kec. Nokilalaki, KAB. SIGI, SULAWESI TENGAH
35.29.21;Kec. Nonggunong, KAB. SUMENEP, JAWA TIMUR
95.02.34;Kec. Nongme, KAB. PEGUNUNGAN BINTANG, PAPUA PEGUNUNGAN
21.71.04;Kec. Nongsa, KOTA BATAM, KEPULAUAN RIAU
76.03.13;Kec. Nosu, KAB. MAMASA, SULAWESI BARAT
61.03.03;Kec. Noyan, KAB. SANGGAU, KALIMANTAN BARAT
71.10.03;Kec. Nuangan, KAB. BOLAANG MONGONDOW TIMUR, SULAWESI UTARA
53.13.05;Kec. Nubatukan, KAB. LEMBATA, NUSA TENGGARA TIMUR
73.24.02;Kec. Nuha, KAB. LUWU TIMUR, SULAWESI SELATAN
72.01.13;Kec. Nuhon, KAB. BANGGAI, SULAWESI TENGAH
95.04.21;Kec. Numba, KAB. TOLIKARA, PAPUA PEGUNUNGAN
94.02.06;Kec. Nume, KAB. PUNCAK JAYA, PAPUA TENGAH
91.06.04;Kec. Numfor Barat, KAB. BIAK NUMFOR, PAPUA
91.06.05;Kec. Numfor Timur, KAB. BIAK NUMFOR, PAPUA
53.02.32;Kec. Nunbena, KAB. TIMOR TENGAH SELATAN, NUSA TENGGARA TIMUR
95.04.19;Kec. Nunggawi, KAB. TOLIKARA, PAPUA PEGUNUNGAN
53.02.17;Kec. Nunkolo, KAB. TIMOR TENGAH SELATAN, NUSA TENGGARA TIMUR
65.03.02;Kec. Nunukan, KAB. NUNUKAN, KALIMANTAN UTARA
65.03.09;Kec. Nunukan Selatan, KAB. NUNUKAN, KALIMANTAN UTARA
11.03.06;Kec. Nurussalam, KAB. ACEH TIMUR, ACEH
81.01.16;Kec. Nusa Laut, KAB. MALUKU TENGAH, MALUKU
51.05.01;Kec. Nusa Penida, KAB. KLUNGKUNG, BALI
71.03.09;Kec. Nusa Tabukan, KAB. KEPULAUAN SANGIHE, SULAWESI UTARA
32.08.20;Kec. Nusaherang, KAB. KUNINGAN, JAWA BARAT
81.71.01;Kec. Nusaniwe, KOTA AMBON, MALUKU
91.05.17;Kec. Nusawani, KAB. KEPULAUAN YAPEN, PAPUA
33.01.05;Kec. Nusawungu, KAB. CILACAP, JAWA TENGAH
32.02.39;Kec. Nyalindung, KAB. SUKABUMI, JAWA BARAT
64.07.16;Kec. Nyuatan, KAB. KUTAI BARAT, KALIMANTAN TIMUR
12.14.21;Kec. O'o'u, KAB. NIAS SELATAN, SUMATERA UTARA
82.72.03;Kec. Oba, KOTA TIDORE KEPULAUAN, MALUKU UTARA
82.72.07;Kec. Oba Selatan, KOTA TIDORE KEPULAUAN, MALUKU UTARA
82.72.06;Kec. Oba Tengah, KOTA TIDORE KEPULAUAN, MALUKU UTARA
82.72.02;Kec. Oba Utara, KOTA TIDORE KEPULAUAN, MALUKU UTARA
93.03.01;Kec. Obaa, KAB. MAPPI, PAPUA SELATAN
82.04.06;Kec. Obi, KAB. HALMAHERA SELATAN, MALUKU UTARA
82.04.28;Kec. Obi Barat, KAB. HALMAHERA SELATAN, MALUKU UTARA
82.04.05;Kec. Obi Selatan, KAB. HALMAHERA SELATAN, MALUKU UTARA
82.04.29;Kec. Obi Timur, KAB. HALMAHERA SELATAN, MALUKU UTARA
82.04.30;Kec. Obi Utara, KAB. HALMAHERA SELATAN, MALUKU UTARA
95.03.08;Kec. Obio, KAB. YAHUKIMO, PAPUA PEGUNUNGAN
53.71.04;Kec. Oebobo, KOTA KUPANG, NUSA TENGGARA TIMUR
53.02.18;Kec. Oenino, KAB. TIMOR TENGAH SELATAN, NUSA TENGGARA TIMUR
94.05.12;Kec. Ogamanim, KAB. PUNCAK, PAPUA TENGAH
72.04.05;Kec. Ogodeide, KAB. TOLI TOLI, SULAWESI TENGAH
74.09.08;Kec. Oheo, KAB. KONAWE UTARA, SULAWESI TENGGARA
95.02.16;Kec. Ok Aom, KAB. PEGUNUNGAN BINTANG, PAPUA PEGUNUNGAN
93.01.03;Kec. Okaba, KAB. MERAUKE, PAPUA SELATAN
95.02.25;Kec. Okbab, KAB. PEGUNUNGAN BINTANG, PAPUA PEGUNUNGAN
95.02.12;Kec. Okbape, KAB. PEGUNUNGAN BINTANG, PAPUA PEGUNUNGAN
95.02.23;Kec. Okbemtau, KAB. PEGUNUNGAN BINTANG, PAPUA PEGUNUNGAN
95.02.03;Kec. Okbibab, KAB. PEGUNUNGAN BINTANG, PAPUA PEGUNUNGAN
95.02.20;Kec. Okhika, KAB. PEGUNUNGAN BINTANG, PAPUA PEGUNUNGAN
95.02.22;Kec. Oklip, KAB. PEGUNUNGAN BINTANG, PAPUA PEGUNUNGAN
95.02.21;Kec. Oksamol, KAB. PEGUNUNGAN BINTANG, PAPUA PEGUNUNGAN
95.02.24;Kec. Oksebang, KAB. PEGUNUNGAN BINTANG, PAPUA PEGUNUNGAN
95.02.01;Kec. Oksibil, KAB. PEGUNUNGAN BINTANG, PAPUA PEGUNUNGAN
95.02.14;Kec. Oksop, KAB. PEGUNUNGAN BINTANG, PAPUA PEGUNUNGAN
35.27.05;Kec. Omben, KAB. SAMPANG, JAWA TIMUR
53.13.06;Kec. Omesuri, KAB. LEMBATA, NUSA TENGGARA TIMUR
94.05.20;Kec. Omukia, KAB. PUNCAK, PAPUA TENGAH
12.16.08;Kec. Onan Ganjang, KAB. HUMBANG HASUNDUTAN, SUMATERA UTARA
12.17.02;Kec. Onan Runggu, KAB. SAMOSIR, SUMATERA UTARA
74.02.37;Kec. Onembute, KAB. KONAWE, SULAWESI TENGGARA
94.05.22;Kec. Oneri, KAB. PUNCAK, PAPUA TENGAH
72.08.22;Kec. Ongka Malino, KAB. PARIGI MOUTONG, SULAWESI TENGAH
12.14.22;Kec. Onohazumba, KAB. NIAS SELATAN, SUMATERA UTARA
12.14.33;Kec. Onolalu, KAB. NIAS SELATAN, SUMATERA UTARA
92.11.02;Kec. Oransbari, KAB. MANOKWARI SELATAN, PAPUA BARAT
91.06.20;Kec. Oridek, KAB. BIAK NUMFOR, PAPUA
91.06.17;Kec. Orkeri, KAB. BIAK NUMFOR, PAPUA
52.04.28;Kec. Orong Telu, KAB. SUMBAWA, NUSA TENGGARA BARAT
91.15.11;Kec. Oudate, KAB. WAROPEN, PAPUA
71.71.11;Kec. Paal Dua, KOTA MANADO, SULAWESI UTARA
15.71.11;Kec. Paal Merah, KOTA JAMBI, JAMBI
35.78.12;Kec. Pabean Cantian, KOTA SURABAYA, JAWA TIMUR
32.09.04;Kec. Pabedilan, KAB. CIREBON, JAWA BARAT
33.22.05;Kec. Pabelan, KAB. SEMARANG, JAWA TENGAH
53.11.12;Kec. Paberiwai, KAB. SUMBA TIMUR, NUSA TENGGARA TIMUR
32.02.37;Kec. Pabuaran, KAB. SUKABUMI, JAWA BARAT
32.09.33;Kec. Pabuaran, KAB. CIREBON, JAWA BARAT
32.13.05;Kec. Pabuaran, KAB. SUBANG, JAWA BARAT
36.04.28;Kec. Pabuaran, KAB. SERANG, BANTEN
53.15.11;Kec. Pacar, KAB. MANGGARAI BARAT, NUSA TENGGARA TIMUR
35.18.05;Kec. Pace, KAB. NGANJUK, JAWA TIMUR
32.03.10;Kec. Pacet, KAB. CIANJUR, JAWA BARAT
32.04.30;Kec. Pacet, KAB. BANDUNG, JAWA BARAT
35.16.03;Kec. Pacet, KAB. MOJOKERTO, JAWA TIMUR
35.24.14;Kec. Paciran, KAB. LAMONGAN, JAWA TIMUR
35.01.04;Kec. Pacitan, KAB. PACITAN, JAWA TIMUR
32.18.07;Kec. Padaherang, KAB. PANGANDARAN, JAWA BARAT
91.06.10;Kec. Padaido, KAB. BIAK NUMFOR, PAPUA
32.06.29;Kec. Padakembang, KAB. TASIKMALAYA, JAWA BARAT
